識別碼,新聞標題,新聞分類,發布日期,新聞前言,新聞連結,來源媒體,來源媒體連結,資料更新時間
news_ef62b63153da32c4e74e5ed22e65e91a,前美國駐聯大使海莉：中若佔台 經濟衝擊超過烏俄戰爭,政治新聞,2024-09-09T21:30:00Z,〔編譯盧永山／綜合報導〕前美國駐聯合國大使、曾角逐共和黨黨內總統提名的海莉，她八日接受哥倫比亞廣播公司新聞網（CBS News）節目訪問時表示，中國若佔領台灣，將嚴重打擊全球經濟，其衝擊甚至大於烏克蘭戰爭，呼籲無論是共和黨總統候選人川普，還是民主黨候選人賀錦麗當選，美國都需要在經濟、軍事和外交方面幫…,https://news.ltn.com.tw/news/politics/paper/1666251,自由時報,https://news.ltn.com.tw/list/breakingnews/politics,09/17/2024 12:20:21
news_b600f68b908581ddf54097ddce9d2556,一週大事（113年9月8日至14日）U18亞青賽 台灣隊擊敗日本封王,政治新聞,2024-09-14T21:30:00Z,"國內：
●台灣隊八日在U18亞洲青棒錦標賽冠軍戰以六比一擊敗日本隊，這是繼二○○一、○七年後第三度在亞青賽封王，也是相隔十七年後再度奪冠。
●新竹基地空軍第二聯隊一架幻象戰機十日疑似動力消失，飛行員謝沛勳上尉彈射跳傘落海，所幸成功獲救生還，空軍下令幻象機隊全面執行特檢。
●台灣證交所、主計總處…",https://news.ltn.com.tw/news/politics/paper/1667157,自由時報,https://news.ltn.com.tw/list/breakingnews/politics,09/22/2024 12:20:16
news_52c1b7766bcf2ce01cbbb9fb49df2d40,美台商會看軍售走向：川普寬鬆 賀錦麗謹慎維持節奏,政治新聞,2024-08-28T23:34:15Z,川普「多付防務費用」一說鬧得滿城風雨，如今美國大選進入短兵相接階段，兩黨對台灣立場更受關注。美台商業協會會長韓儒伯今天表示，若川普當家對台軍售將更為寬鬆，賀錦麗政府則保持軍售節奏，態度更謹慎...…,https://news.ltn.com.tw/news/politics/breakingnews/4783469,自由時報,https://news.ltn.com.tw/list/breakingnews/politics,09/05/2024 12:20:18
news_6df98aaf18a0815d27309d1563d72d34,美民調：66％認為台灣需擴張軍備抗中 再給協防保證,政治新聞,2024-08-10T04:00:33Z,近期一份智庫民調顯示，66%的美國受訪者同意美國應該要求台灣在美國做出保衛台灣的承諾前，投入更多的資源強化自身抗中的實力，34%則不同意。另30%支持美國應該不計代價保護台灣不被中國入侵，3...…,https://news.ltn.com.tw/news/politics/breakingnews/4764575,自由時報,https://news.ltn.com.tw/list/breakingnews/politics,08/17/2024 12:17:40
news_3c92e094df8681e4b03ca7e789530acf,美民調：66%認為台灣需擴張軍備抗中 再給協防保證,國內政治,2024-08-09T23:55:30Z,（中央社記者鍾佑貞華盛頓9日專電）近期一份智庫民調顯示，66%的美國受訪者同意美國應該要求台灣在美國做出保衛台灣的承諾前，投入更多的資源強化自身抗中的實力，34%則不同意。另30%支持美國應該不計代價保護台灣不被中國入侵，37%抱持反對立場。,https://www.cna.com.tw/news/aipl/202408100022.aspx,中央通訊社,https://www.cna.com.tw/list/aipl.aspx,08/17/2024 12:17:40
news_39f95c9f4c724007d882c0b8ca59d526,美通過「台灣衝突嚇阻法案」　李彥秀：外交最忌諱炒短線亂壓寶,政治新聞,2024-09-11T02:21:00Z,美國聯邦眾議院9日通過多項抗中法案，其中包括「台灣衝突嚇阻法案」，內容涉及若北京對台動武，將揭露中國大陸領導高層的資產，禁止他們及其家人使用美國金融體系及凍結資產等措施。對此，國民黨立委李彥秀提醒賴清德政府，友邦的支持不是民進黨大內宣的工具，更不是獲取個人政治利益的籌碼，任何兩岸與外交工作的推動，都必須戒慎恐懼，最忌諱炒短線、亂壓寶。,https://www.ettoday.net/news/20240911/2814836.htm,2011 ETtoday.net. All Rights Reserved.,https://www.ettoday.net,09/18/2024 12:24:02
news_bf56742b7d50d0ca765572942217819e,美國總統選舉  藍綠白合辦研討會關注台美關係,國內政治,2024-08-26T05:38:23Z,（中央社記者范正祥台北26日電）美國將於11月舉行總統大選，舉世關注。朝野代表今天在一場研討會表示，美國各黨派都是台灣珍惜的朋友，台灣不會選邊站，但應關注美國大選後經貿走向，以及相關地緣政治變化。,https://www.cna.com.tw/news/aipl/202408260124.aspx,中央通訊社,https://www.cna.com.tw/list/aipl.aspx,09/02/2024 12:19:27
news_90b0972f1c70f8b9c4773f4e25830600,川普稱賣給中國的晶片來自台灣 許美華苦笑：還真的很難反駁,政治新聞,2024-09-11T13:43:46Z,"祝蘭蕙／核稿編輯
美國民主黨總統候選人賀錦麗（Kamala Harris）在本月10日的總統辯論會上指控共和黨候選人川普（Donald Trump）執政時「把美國晶片賣給中國」，...…",https://news.ltn.com.tw/news/politics/breakingnews/4797152,自由時報,https://news.ltn.com.tw/list/breakingnews/politics,09/18/2024 12:24:02
news_ac8e285d97f1422518deea65cf6376e6,拜登對台軍援 白宮：為台海和平穩定,政治新聞,2024-10-01T21:30:00Z,"〔記者黃靖媗、吳哲宇、編譯管淑平／綜合報導〕美國總統拜登已宣布提供台灣最多五．六七億美元（約新台幣一七九億元）的防衛物資及服務，這是他第二度動用「總統提用權」軍援台灣。白宮發言人尚皮耶美東時間九月三十日指出，軍援目的是為維持台海和平穩定。
中央社報導，尚皮耶在記者會回答媒體提問時指出，美國的總體目…",https://news.ltn.com.tw/news/politics/paper/1669954,自由時報,https://news.ltn.com.tw/list/breakingnews/politics,10/09/2024 12:20:27
news_2df0eee52eb210cd23b8b34d8a8bf2e1,台劇零日攻擊受矚 美媒：中國可能侵台激發娛樂創作,國內政治,2024-10-04T15:13:24Z,（中央社台北4日綜合外電報導）美國「華爾街日報」指出，中國入侵台灣的噩夢激發台灣娛樂產業出現打破禁忌的作品，包括文化部支持的台劇「零日攻擊」、漫畫小說「燃燒的西太平洋」以及名為「2045」的桌遊。,https://www.cna.com.tw/news/aipl/202410040429.aspx,中央通訊社,https://www.cna.com.tw/list/aipl.aspx,10/11/2024 12:22:14
news_ba79bbd47a8c8569dd86aac89971f711,拜登最大筆對台軍援含哪些品項？國務院賣關子多著墨援台立場,國內政治,2024-10-01T23:38:29Z,（中央社記者鍾佑貞華盛頓1日專電）美國上批援台軍備品出現發霉防彈衣及過期彈藥，使近日宣布的最大筆軍援品項成為焦點。美國國務院今天未回覆軍援細節，只說包括「關鍵防禦庫存」及強化台灣當前及未來嚇阻力的自衛設備。,https://www.cna.com.tw/news/aipl/202410020016.aspx,中央通訊社,https://www.cna.com.tw/list/aipl.aspx,10/09/2024 12:20:27
news_f3b320903332d75d0f70139dfce63014,AIT前主席薄瑞光：川普較不熱衷結盟 不利美對台政策,國內政治,2024-09-12T00:02:57Z,（中央社記者石秀娟華盛頓11日專電）前美國在台協會主席薄瑞光今天在一場線上論壇說，美國與亞洲盟友結盟是其處理台灣議題的關鍵要點之一，共和黨總統候選人川普對此較不熱衷，若這一政策重點弱化，對美國的台灣政策是不利的。,https://www.cna.com.tw/news/aipl/202409120023.aspx,中央通訊社,https://www.cna.com.tw/list/aipl.aspx,09/19/2024 12:19:21
news_420d2d3cf386cd9124040dc42c016b80,川普喊台國防支出應達GDP10％！　李彥秀：科幻小說編劇都寫不出來,政治新聞,2024-10-02T03:54:00Z,華盛頓郵報刊出美國共和黨總統候選人川普專訪，川普認為中國大陸終究會攻打台灣，但不會在他任內發生；還說台灣國防支出不足，台灣軍費應提高到國內生產毛額（GDP）10%。國民黨立委李彥秀2日轟，如此驚人的數字，恐怕連「科幻小說編劇都寫不出來」，更凸顯了川普與其幕僚對台灣的了解，與現實有非常大的出入，她呼籲賴清德，台灣不能只有「備戰」，而沒有「止戰」的方法與智慧。,https://www.ettoday.net/news/20241002/2827775.htm,2011 ETtoday.net. All Rights Reserved.,https://www.ettoday.net,10/09/2024 12:20:27
news_3a59009e5c5eabb3f9a551f7e924c69b,川普拋「台軍費佔GDP10%」　王鴻薇：政府當細漢不敢回應,政治新聞,2024-10-02T04:14:00Z,美國共和黨總統候選人川普在接受媒體專訪時指出，台灣國防支出不足，台灣軍費應提高到國內生產毛額（GDP）的10％。國民黨立委王鴻薇表示，面對川普強人所難的狂言，政府竟然不敢做任何一聲評論，看起來像是逆來順受的樣子，但該說的還是要說、該反映的還是要反映，不然會被認為台灣真的是「細漢」的。,https://www.ettoday.net/news/20241002/2827795.htm,2011 ETtoday.net. All Rights Reserved.,https://www.ettoday.net,10/09/2024 12:20:27
news_8d83fff585fb08f81fb4927af4bba4ab,川普拋「台國防支出GDP10％」　他算要2.6兆：國家基本上無法運作,政治新聞,2024-10-02T07:30:00Z,美國共和黨總統候選人川普在接受媒體專訪時指出，台灣國防支出不足，台灣軍費應提高到國內生產毛額（GDP）的10％。對此，資深媒體人黃暐瀚2日表示，這是天方夜譚，以此數據，台灣1年得編2.6兆的軍事預算，但政府總預算1年才3兆，拿2.6兆在國防上，這國家基本上沒辦法運作了。,https://www.ettoday.net/news/20241002/2827893.htm,2011 ETtoday.net. All Rights Reserved.,https://www.ettoday.net,10/09/2024 12:20:27
news_df08e357627ec62bdccd4649c5622fc8,顧立雄：美國維持台海戰略模糊 藉此進行嚇阻,國內政治,2024-10-23T06:52:04Z,（中央社記者吳書緯、游凱翔台北23日電）美國共和黨總統候選人川普（Donald Trump）日前表示，如果中國「進入」台灣，他將對中國徵收額外關稅。針對中國若入侵台灣美國是否出兵，國防部長顧立雄今天表示，美國迄今為止仍維持戰略模糊政策，藉此進行嚇阻。,https://www.cna.com.tw/news/aipl/202410230187.aspx,中央通訊社,https://www.cna.com.tw/list/aipl.aspx,10/30/2024 12:36:24
news_882f50a6feb91e2a295cbf948d10c83f,川普稱台灣國防預算應升至GDP10％ 黃暐瀚：簡直天方夜譚,政治新聞,2024-10-02T03:48:44Z,"黃其豪／核稿編輯
美國共和黨總統候選人川普（Donald Trump）上月中旬針對台海安全議題表示，中國終究會攻打台灣，但不會在他任內發生。同時，他認為台灣的國防支出應提高到國內...…",https://news.ltn.com.tw/news/politics/breakingnews/4817858,自由時報,https://news.ltn.com.tw/list/breakingnews/politics,10/09/2024 12:20:27
news_5322f95418055f8bcf8e68aee9d632da,川普稱台灣國防支出應占GDP10％ 藍委：強人所難,政治新聞,2024-10-02T03:11:10Z,美國共和黨總統候選人川普接受華盛頓郵報專訪，指台灣國防支出不足，台灣軍費應提高到國內生產毛額（GDP）10%。國民黨立委李彥秀表示，此發言凸顯川普對台灣的瞭解與現實有非常大的出...…,https://news.ltn.com.tw/news/politics/breakingnews/4817902,自由時報,https://news.ltn.com.tw/list/breakingnews/politics,10/09/2024 12:20:27
news_ad76098f6698852f4b5de07804e73978,川普指台灣國防支出應占GDP10％ 林憶君：為了選舉的「浮誇語言」,政治新聞,2024-10-02T06:04:27Z,美國共和黨總統候選人川普接受華盛頓郵報專訪，指台灣國防支出不足，台灣軍費應提高到國內生產毛額（GDP）10%。民眾黨籍立院國防外交委員會召委林憶君指出，台灣明年度國防預算首度超...…,https://news.ltn.com.tw/news/politics/breakingnews/4818121,自由時報,https://news.ltn.com.tw/list/breakingnews/politics,10/09/2024 12:20:27
news_8d5ae14733c5a00c9e201d1c0e380e12,台灣政客討好人民放颱風假 謝金河︰沒人計較決策是否精準？,政治新聞,2024-10-02T11:26:04Z,"黃筱薇／核稿編輯
山陀兒颱風龜速移動逐漸接近台灣，即便尚未登陸，全台22個縣市仍在今（2）日停班停課，引起民眾熱議。對此，財信傳媒董事長謝金河指出，台灣的政客努力討好人民，讓人們...…",https://news.ltn.com.tw/news/politics/breakingnews/4818369,自由時報,https://news.ltn.com.tw/list/breakingnews/politics,10/09/2024 12:20:27
news_3d47ca36775a86bd31597f268744f5cf,美前國安顧問波頓：川普若重返白宮 台灣可能會遭殃[影],國內政治,2024-10-25T15:31:33Z,（中央社華盛頓25日綜合外電報導）美國前總統川普執政時期國安顧問波頓接受英國廣播公司（BBC）節目HARDtalk訪問時表示，若川普重返白宮，「台灣可能會遭殃」。,https://www.cna.com.tw/news/aipl/202410250392.aspx,中央通訊社,https://www.cna.com.tw/list/aipl.aspx,11/01/2024 12:25:08
news_ab134f047acb75a758ac35082aefbac7,中國認知戰曝擔憂美選結果 學者：川普曾讓中國「痛」,政治新聞,2024-11-06T13:16:09Z,美國共和黨總統候選人、前總統川普已自行宣布當選美國總統，外界關注未來台美關係發展。台灣智庫中國問題研究中心主任吳瑟致分析，中國在美選期間透過疑美論、疑賴論、「押寶說」，試圖影響台...…,https://news.ltn.com.tw/news/politics/breakingnews/4854939,自由時報,https://news.ltn.com.tw/list/breakingnews/politics,11/13/2024 12:20:52
news_0b146362d1fbef1ebe425b84f75ad00b,川普反中不代表友台 楊瓊瓔：政府應重新審視「新台美關係」,政治新聞,2024-11-06T13:51:44Z,美國總統大選由川普勝選，國民黨立委楊瓊瓔表示，川普的外交政策被認為偏向孤立、保護主義，或許美國「反中」氣氛會維持一貫，但「反中」不代表就會「友台」，川普競選拋出的「台灣交保護費...…,https://news.ltn.com.tw/news/politics/breakingnews/4854926,自由時報,https://news.ltn.com.tw/list/breakingnews/politics,11/13/2024 12:20:52
news_e4ed348530c6c9607b57790f2cdb56de,美眾議員：無論誰入主白宮 國會挺台力道強大,國內政治,2024-10-05T07:20:27Z,（中央社記者林宏翰洛杉磯4日專電）美國大選將近，國會議員出席洛杉磯雙十國慶酒會，談總統選舉對台美關係影響。不分黨派認為，美國國會挺台力道強大，台美關係會持續堅實穩固。,https://www.cna.com.tw/news/aipl/202410050122.aspx,中央通訊社,https://www.cna.com.tw/list/aipl.aspx,10/12/2024 12:20:49
news_a81d9f3ef48e895857eda0b2eee06440,美國安顧問訪陸強調美中關係穩定　藍委：賴清德還繼續當鴕鳥嗎？,政治新聞,2024-08-28T03:08:00Z,美國國家安全顧問蘇利文（Jake Sullivan）27日抵達中國大陸，昨天在北京與中共外交部長王毅見面，會面過程，蘇利文表示，美方致力於負責任地管理美中關係，避免競爭演變為衝突；王毅強調，中美除了戰略性和實質性溝通外，更應具有「建設性」。對此，國民黨立委李彥秀表示，美中高層面對面的溝通，對美國未來地緣政治上佈局，是重要且必要的，而美中已經演給賴清德政府看了，難道賴清德還要繼續當鴕鳥嗎？,https://www.ettoday.net/news/20240828/2805910.htm,2011 ETtoday.net. All Rights Reserved.,https://www.ettoday.net,09/04/2024 12:19:48
news_51073e37d08390441e19bb3d99829dda,美眾議院「中國週」落幕 通過法案挺台灣全面參與世衛,國內政治,2024-09-12T19:31:16Z,（中央社記者鍾佑貞華盛頓12日專電）美國眾議院「中國週」今天落幕，這4天連番通過多項涉及中國或台灣的法案，包括以金融工具嚇阻北京犯台、支持台灣全面參與世衛、強化與台灣及南太島國合作，及賦予監管機構「肌肉」審核中國購地案等。,https://www.cna.com.tw/news/aipl/202409130007.aspx,中央通訊社,https://www.cna.com.tw/list/aipl.aspx,09/20/2024 12:19:11
news_967bd88b0d13d771c4cc7d7e8b12143e,川普稱台灣國防支出應佔GDP10% 綠委︰他在選舉嘛 藍委︰把台灣當「細漢」,政治新聞,2024-10-02T21:30:00Z,〔記者劉宛琳、謝君臨、林哲遠／台北報導〕美國共和黨總統候選人川普九月接受華盛頓郵報專訪，指台灣國防預算支出不足，應提高到國內生產毛額（GDP）百分之十。國民黨立委昨指出，百分之十超過新台幣兩兆元，對於這樣無理要求，政府應該要反映。民進黨立委則說，希望國際可以看到台灣目前正在盡全力提高國防預算，也全力…,https://news.ltn.com.tw/news/politics/paper/1670149,自由時報,https://news.ltn.com.tw/list/breakingnews/politics,10/10/2024 12:20:42
news_c39bd67537c6f177d05c56a895b5882c,葉望輝：白宮主人確定後 台灣應立刻拋軍購單示決心【專訪】,國內政治,2024-09-14T23:47:02Z,（中央社記者鍾佑貞華盛頓14日專電）川普與賀錦麗選情膠著，美國前副總統錢尼的副國安顧問葉望輝建議，下屆美國總統出爐後，台灣應立刻接觸，提出有效自衛的軍購清單，這樣做不僅引發美國防產業共鳴，還能讓批評台灣未做足準備的人閉嘴。,https://www.cna.com.tw/news/aipl/202409150010.aspx,中央通訊社,https://www.cna.com.tw/list/aipl.aspx,09/22/2024 12:20:16
news_d6e0534aa60b878040438a167749d3fe,援台軍備發霉、子彈1983年產 美共和黨議員要求解釋,國內政治,2024-10-24T03:22:39Z,（中央社華盛頓23日綜合外電報導）美國國防部監察長的報告發現，五角大廈將發霉的防彈背心與1980年代的裝備運給台灣；對此，愛荷華州共和黨籍聯邦參議員恩斯特批評拜登政府領導失敗，致函國防部要求解釋。,https://www.cna.com.tw/news/aipl/202410240067.aspx,中央通訊社,https://www.cna.com.tw/list/aipl.aspx,10/31/2024 12:19:48
news_8b34247ecabf3c0482aaa0eec7204382,川普勝選台灣還能指望美國嗎？專家投書華爾街日報分析可能性,國內政治,2024-08-29T03:20:43Z,（中央社台北29日綜合外電報導）美國總統大選將於11月登場，智庫專家以「川普若勝選，台灣還能指望美國嗎？」為題投書華爾街日報，分析川普重返白宮可能對台政策，以及美國應如何協助台灣應對中國威脅。,https://www.cna.com.tw/news/aipl/202408290087.aspx,中央通訊社,https://www.cna.com.tw/list/aipl.aspx,09/05/2024 12:20:18
news_1ef7eed2eb5c510a1463074c46a01a5e,美台商會看軍售走向：川普寬鬆賀錦麗謹慎維持節奏,國內政治,2024-08-28T23:14:19Z,（中央社記者鍾佑貞華盛頓28日專電）川普「多付防務費用」一說鬧得滿城風雨，如今美國大選進入短兵相接階段，兩黨對台灣立場更受關注。美台商業協會會長韓儒伯今天表示，若川普當家對台軍售將更為寬鬆，賀錦麗政府則保持軍售節奏，態度更謹慎。,https://www.cna.com.tw/news/aipl/202408290018.aspx,中央通訊社,https://www.cna.com.tw/list/aipl.aspx,09/05/2024 12:20:18
news_09cdc28242b4ce999b55e4d8ddfb315d,范斯：北京終將侵略台灣 美軍武器全給烏克蘭不利台禦敵,國內政治,2024-09-14T00:04:47Z,（中央社記者鍾佑貞華盛頓13日專電）川普的副手范斯曾表達對中國強硬、支持軍援台灣等看法。他昨天再次談到相關議題時，推測北京最終仍會對台動武，而美國把所有的武器都給烏克蘭，「我不知道台灣現在是否能抵禦中國入侵」。,https://www.cna.com.tw/news/aipl/202409140015.aspx,中央通訊社,https://www.cna.com.tw/list/aipl.aspx,09/21/2024 12:20:00
news_9bf4383dc281e49adbc83cdc14f214ca,郭智輝：若支持護國神山台積電 就支持台電建廠,國內政治,2024-10-29T02:31:00Z,（中央社記者陳俊華台北29日電）AIT處長谷立言說，台灣的綠能無法滿足未來AI對半導體的要求。行政院長卓榮泰今天表示，政府一直對台灣民生、產業用電提出安全無虞的保證跟努力，對全世界夥伴國家或是民主供應鏈的夥伴們，也做相同責任的承諾。,https://www.cna.com.tw/news/aipl/202410290052.aspx,中央通訊社,https://www.cna.com.tw/list/aipl.aspx,11/05/2024 12:22:34
news_19890aa8c9e4cbd25c55095e52f97830,蘇利文指美將持續對台軍售 有助維持台海和平穩定,國內政治,2024-08-29T21:34:36Z,（中央社記者石秀娟華盛頓29日專電）美國白宮國家安全顧問蘇利文29日在北京召開的記者會指出，美國對台軍售是依照美國的一中政策，該政策數十年來幫助維持台灣海峽的和平與穩定，美國將會繼續維持這個作法。,https://www.cna.com.tw/news/aipl/202408300013.aspx,中央通訊社,https://www.cna.com.tw/list/aipl.aspx,09/06/2024 12:20:37
news_f7785ddc88cf9dd9e1d74b79bbbf9981,蓬佩奧挺台國際參與：悔為香港做不多 盼續為台付出,國內政治,2024-09-17T23:32:54Z,（中央社記者鍾佑貞華盛頓17日專電）美國前國務卿蓬佩奧今天在智庫研討會上提到，香港2020年「陷落」，他任國務卿時，最遺憾的事情之一就是未能為香港人做得更多，盼繼續為台灣民眾付出；無論明年1月誰入主白宮，美國將信守對台承諾。,https://www.cna.com.tw/news/aipl/202409180014.aspx,中央通訊社,https://www.cna.com.tw/list/aipl.aspx,09/25/2024 12:19:24
news_af9b1d28ca1a7d161f502d0134c273f4,美大選倒數 俞大㵢：台灣政府已分別與川賀陣營接觸,國內政治,2024-10-05T03:23:47Z,（中央社記者鍾佑貞華盛頓4日專電）駐美代表俞大㵢近期接受美國福斯新聞頻道（Fox News）訪問時表示，中國、伊朗及俄羅斯正在形成「聯盟」，全球應該為此做好準備；另接近美國大選，台灣政府已與賀錦麗及川普的人馬接觸，以因應未來變局。,https://www.cna.com.tw/news/aipl/202410050051.aspx,中央通訊社,https://www.cna.com.tw/list/aipl.aspx,10/12/2024 12:20:49
news_486021b1deedc3a0c688aaf72776eb5e,美大選將至  李文忠：誰當選均對中強硬關注台海,國內政治,2024-11-04T06:19:40Z,（中央社記者游凱翔、楊堯茹台北4日電）美國大選將至，國防安全研究院執行長李文忠今天說，無論誰當選，美國民主、共和兩黨對中國將一樣強硬，同樣高度關心台海議題；至於共和黨候選人川普提到「保護費」，他認為應是要台灣提升國防預算及強化軍購。,https://www.cna.com.tw/news/aipl/202411040148.aspx,中央通訊社,https://www.cna.com.tw/list/aipl.aspx,11/11/2024 12:21:39
news_ea7279aae56c5d38e6773eeaa5426339,美大選倒數 俞大（水雷）：台灣政府已分別與川賀陣營接觸,政治新聞,2024-10-05T04:36:31Z,駐美代表俞大（水雷）近期接受美國福斯新聞頻道（Fox News）訪問時表示，中國、伊朗及俄羅斯正在形成「聯盟」，全球應該為此做好準備；另接近美國大選，台灣政府已與賀錦麗及川普的人馬接觸，以因...…,https://news.ltn.com.tw/news/politics/breakingnews/4820979,自由時報,https://news.ltn.com.tw/list/breakingnews/politics,10/12/2024 12:20:49
news_64c46ef86e253162d8ac8a1af0dc432f,川普若當選國防預算暴增？卓榮泰：不可能一夕間擴大,國內政治,2024-11-05T11:09:36Z,（中央社記者陳俊華台北5日電）國民黨立委謝衣鳯今天指出，若美國總統大選由川普勝出，要求台灣將國防預算增加到GDP的10%如何因應。行政院長卓榮泰說，不可能一夕之間把國防預算擴大，未來也絕對不會排擠其他預算。,https://www.cna.com.tw/news/aipl/202411050380.aspx,中央通訊社,https://www.cna.com.tw/list/aipl.aspx,11/12/2024 12:20:31
news_f9e80ecd8a64228abc11eea7a80b554f,川普發表勝選談話  朱立倫祝賀盼促成區域和平穩定,國內政治,2024-11-06T08:48:08Z,（中央社記者劉冠廷台北6日電）美國總統選舉共和黨候選人川普發表勝選談話，國民黨主席朱立倫透過黨駐美代表處向共和黨表達祝賀，賀電也由國際部轉交美國在台協會台北辦事處；朱立倫表示，期待川普延續前一任期調解地緣衝突的努力，全力促成區域局勢的和平穩定。,https://www.cna.com.tw/news/aipl/202411060279.aspx,中央通訊社,https://www.cna.com.tw/list/aipl.aspx,11/13/2024 12:20:52
news_b54ba2bc8fd36a78c9a8c4cad2a12396,美大選後辦高峰論壇 江啟臣：為國家生存發展集思廣益,政治新聞,2024-11-03T11:30:19Z,美國總統大選投票將於美國時間11月5日結束，啟思民本基金會將於8日在立法院群賢樓101會議室舉辦「美國總統大選後的地緣政治經濟與兩岸關係」國際高峰論壇，深入探討美國總統大選後的...…,https://news.ltn.com.tw/news/politics/breakingnews/4851245,自由時報,https://news.ltn.com.tw/list/breakingnews/politics,11/10/2024 12:28:00
news_01f4d543e18519b73fce2c5db27138f2,賴總統拋祖國論 美國務院：台海穩定是美國根本利益,國內政治,2024-10-08T17:40:16Z,（中央社記者鍾佑貞華盛頓8日專電）總統賴清德日前於國慶晚會致詞時拋出「祖國論」。美國國務院主管東亞事務的亞太助卿康達今天回應，美國多年的一中政策不變，美國的根本利益在於維護台海和平穩定，「這將持續是我們未來的重點」。,https://www.cna.com.tw/news/aipl/202410090004.aspx,中央通訊社,https://www.cna.com.tw/list/aipl.aspx,10/16/2024 12:26:12
