識別碼,新聞標題,新聞分類,發布日期,新聞前言,新聞連結,來源媒體,來源媒體連結,資料更新時間
news_9eb96edcb2202425e6269a9c608cf265,確認了！第700名韓戰失蹤士兵　隸屬美騎一師,y 軍武,2024-09-17T03:29:00Z,美國國防部戰俘與失蹤人員鑑識署（DPAA）9日宣布確認第700名韓戰失蹤士兵身分，是來自德州達拉斯的18歲陸軍下士德萊弗（Billie Charles Driver），隸屬於第1騎兵師，於1950年9月5日在釜山環形防禦戰役中陣亡。,https://www.ettoday.net/news/20240917/2818431.htm,2011 ETtoday.net. All Rights Reserved.,https://www.ettoday.net,09/24/2024 12:22:54
news_d49395a32a9b07c2b857f3c0b4a35afe,美國權力真空期 呂秀蓮：朝野都應謹言慎行,國內政治,2024-10-09T08:51:44Z,（中央社記者葉素萍台北9日電）前副總統呂秀蓮今天表示，美國進入權力真空期，11月美國總統大選投票結果，不知道誰贏，當選後也要到明年才就職，海軍司令唐華指出，中共解放軍正利用「蟒蛇策略」壓縮台灣，這絕非玩笑，三軍統帥、台灣3個政黨都要謹言慎行、相忍為國。,https://www.cna.com.tw/news/aipl/202410090297.aspx,中央通訊社,https://www.cna.com.tw/list/aipl.aspx,10/16/2024 12:26:12
news_3eaed08f1c8651f33ff322294b990df6,谷立言願助破除疑美論 蕭美琴：他講得很好,國內政治,2024-10-28T02:21:12Z,（中央社記者曾以寧台北28日電）美國在台協會（AIT）處長谷立言（Raymond Greene）日前受訪談及台美關係，並表示願意協助破除疑美論。副總統蕭美琴今天被問及此訪談內容表示，「他講得很好」。,https://www.cna.com.tw/news/aipl/202410280044.aspx,中央通訊社,https://www.cna.com.tw/list/aipl.aspx,11/04/2024 12:19:13
news_327dd9762ed733b0ba3bd063c66a0dfa,谷立言：美台關係跨黨派支持 不擔心美基本路線改變,國內政治,2024-10-27T08:24:57Z,（中央社記者楊堯茹台北27日電）美國總統大選倒數不到兩週，美國在台協會處長谷立言受訪表示，不論是賀錦麗或是川普當選，「不擔心美國的基本路線改變」，美台關係具有跨黨派支持，對亞洲的外交政策也不會有太大改變。,https://www.cna.com.tw/news/aipl/202410270138.aspx,中央通訊社,https://www.cna.com.tw/list/aipl.aspx,11/03/2024 12:30:28
news_42eed1fc1d6756ea376e4a75fa297fec,祝賀川普重返白宮！民眾黨：盼美方持續與台灣緊密合作,政治新聞,2024-11-06T08:40:15Z,美國總統大選持續開票中，共和黨總統候選人川普（Donald Trump）稍早在佛羅裡達州登台，向支持者們宣布在美國總統大選中獲勝。對此，民眾黨發聲明表示，本黨在此特表誠摯祝賀之...…,https://news.ltn.com.tw/news/politics/breakingnews/4854532,自由時報,https://news.ltn.com.tw/list/breakingnews/politics,11/13/2024 12:20:52
news_7eb9cbec2a3c78f7e341ae27f211a3b4,美國大選後台美關係、印太戰略有變化？　谷立言：不擔心,政治新聞,2024-10-27T07:20:00Z,美國在台協會（AIT）處長谷立言近日接受「敏迪選讀」Podcast專訪時，被問及美國總統大選後，台美關係或印太戰略是否會有變化？谷立言表示，不論是賀錦麗（Kamala Harris）或川普（Donald Trump），他都不擔心，選後也會繼續，包括對台灣的軍事協助、經貿關係，都不會有很大改變。,https://www.ettoday.net/news/20241027/2843164.htm,2011 ETtoday.net. All Rights Reserved.,https://www.ettoday.net,11/03/2024 12:30:28
news_9310dbb6ff05d73da25483a68c00e6c3,美國大選下週登場 卓榮泰：台美關係持續強化應沒問題,政治新聞,2024-11-01T12:02:22Z,美國5日將舉行總統大選，國民黨立委林德福今（1日）質詢關切美選結果對台影響。行政院長卓榮泰答詢表示，台美關係長年往良性發展，未來美國透過民主選舉產生民主政府，跟台美關係持續...…,https://news.ltn.com.tw/news/politics/breakingnews/4849772,自由時報,https://news.ltn.com.tw/list/breakingnews/politics,11/08/2024 12:29:53
news_61b36bd42dedb247bbc988078ef4c2cc,不論賀、川誰當選總統 谷立言：不必擔心美對台基本路線改變,政治新聞,2024-10-27T21:30:00Z,"台美關係 一直獲美國跨黨派支持
〔記者黃靖媗／綜合報導〕美國總統大選將於下月五日登場，針對選後的局勢，美國在台協會（AIT）處長谷立言表示，不管是民主黨總統候選人賀錦麗或共和黨總統候選人川普當選，都不必擔心美國對台基本路線改變，台美關係一直獲美國跨黨派支持，包括對台灣的軍事協助，選後也會繼續下去。…",https://news.ltn.com.tw/news/politics/paper/1674221,自由時報,https://news.ltn.com.tw/list/breakingnews/politics,11/04/2024 12:19:13
news_2e839051a67f66efc687b0678ddf35b1,駐英代表姚金祥受訪  籲英國支持台灣參與INTERPOL,國內政治,2024-11-03T23:23:54Z,（中央社記者陳韻聿倫敦3日專電）駐英國代表姚金祥近日接受英國「泰晤士電台」（Times Radio）專訪，談及英國等理念相近國家支持台灣有意義參與國際組織，並對英國能明確表態支持台灣參與國際刑警組織（INTERPOL）表示期待。,https://www.cna.com.tw/news/aipl/202411040014.aspx,中央通訊社,https://www.cna.com.tw/list/aipl.aspx,11/11/2024 12:21:39
news_3c606db1ccfe329dc54cb93334bebfd5,對中政策比一比 賀錦麗偏務實、川普重交易 都未承諾協防台灣,國內政治,2024-11-04T00:19:01Z,（中央社記者石秀娟華盛頓4日專電）美中戰略競爭格局持續，民主黨總統候選人賀錦麗、共和黨川普都視中國為主要對手，但政策不同。川普交易性格強，不可預測性高；賀錦麗大致延續拜登路線，重務實。兩人對協防台灣尚無承諾。,https://www.cna.com.tw/news/aipl/202411040017.aspx,中央通訊社,https://www.cna.com.tw/list/aipl.aspx,11/11/2024 12:21:39
news_8a7bab38b192c76d12444476ff534ed3,馬辦控賴清德設連環套　「營造軍演氛圍再激怒中國換政治利益」,政治新聞,2024-10-08T03:00:00Z,總統賴清德在5日大巨蛋國慶晚會上表示，從年紀上來說，中共絕不可能是中華民國祖國，「祖國論」引發熱議。外媒則引述台國安官員報導，中國在10日當天可能在台灣周邊舉行軍演。馬英九基金會執行長蕭旭岑對此表示，讓人憂心這是賴當局的「連環套」，先營造大陸軍演的氛圍，然後在雙十國慶演說「加料」，激怒大陸強烈反應，以獲取政治利益。,https://www.ettoday.net/news/20241008/2831232.htm,2011 ETtoday.net. All Rights Reserved.,https://www.ettoday.net,10/15/2024 12:24:01
news_f71bf439eaee7829ab388657aeaf5e88,華爾街日報投書：賀錦麗與川普都小看北京威脅 錯讀台海局勢,國內政治,2024-10-28T02:15:10Z,（中央社華盛頓27日綜合外電報導）距11月5日美國總統大選不到兩週，有學者發現共和黨候選人川普覺得靠關稅就能嚇阻北京侵台，民主黨候選人賀錦麗則把優先擺在伊朗等次要對手上，兩人恐都錯讀台海情勢。,https://www.cna.com.tw/news/aipl/202410280043.aspx,中央通訊社,https://www.cna.com.tw/list/aipl.aspx,11/04/2024 12:19:13
news_4308222708daab0e682423c66322a4dc,郭育仁：日本政局不穩定 對美日台關係是壞消息,國內政治,2024-10-28T06:27:56Z,（中央社記者楊堯茹台北28日電）日本自民黨及公明黨所組的執政聯盟未取得眾議院過半席次。學者坦言，「最大贏家是中國國家主席習近平」，可對日本各黨一一擊破；未來在與美國的雙邊峰會，日方還會不會提及台海和平的重要性，「必須打上問號」。,https://www.cna.com.tw/news/aipl/202410280149.aspx,中央通訊社,https://www.cna.com.tw/list/aipl.aspx,11/04/2024 12:19:13
news_3053c455277eb51a0bc665362f4dfe1c,蕭旭岑：預防賴清德「戳眼睛」挑釁中國 換取政治利益,政治新聞,2024-10-08T02:57:14Z,針對國安官員透過外媒釋出賴清德總統發表雙十國慶演說後，中國很可能在台灣周邊舉行軍演，馬英九基金會執行長蕭旭岑今日質疑，讓人憂心這是賴當局的「連環套」，先營造中國軍演的氛圍，然後...…,https://news.ltn.com.tw/news/politics/breakingnews/4823699,自由時報,https://news.ltn.com.tw/list/breakingnews/politics,10/15/2024 12:24:01
news_4638fd449171756a91c83665e4722407,川普當選美國總統 行政院：持續強化各項合作,政治新聞,2024-11-06T12:55:55Z,"美國第47任總統、副總統由美國共和黨總統候選人川普、副總統候選人范斯當選，行政院發言人李慧芝表示，政府會持續強化各項合作，與具有共同民主價值理念的美國政府，共同深化台美關係。
...…",https://news.ltn.com.tw/news/politics/breakingnews/4854910,自由時報,https://news.ltn.com.tw/list/breakingnews/politics,11/13/2024 12:20:52
news_337225733bb33d0014eb15eb46943528,董立文：川普是印太戰略創始者 對台政策方向不會變,政治新聞,2024-11-06T12:52:26Z,美國共和黨總統候選人、前總統川普已自行宣布當選美國總統，外界關注未來台美關係發展，學者董立文認為，川普是印太戰略的創始者，過去執政時，台美關係在各領域都有重大突破，相信政策方向與...…,https://news.ltn.com.tw/news/politics/breakingnews/4854915,自由時報,https://news.ltn.com.tw/list/breakingnews/politics,11/13/2024 12:20:52
news_6985e780c3712cb85f639cc36662c485,川普重返白宮　台美21世紀倡議、租稅協定談判添變數,政治新聞,2024-11-06T10:45:00Z,美國總統大選結果出爐，台美經貿談判兩大焦點走向備受關注。台美21世紀貿易倡議首批協定部分，雙方程序幾近完備，有望年底生效，雖然經貿辦樂觀評估，後續談判應不受拜登政府卸任影響，但由於川普一向反全球化，主張貿易保護主義，恐添未來4年台美雙邊經貿往來變數。,https://www.ettoday.net/news/20241106/2849932.htm,2011 ETtoday.net. All Rights Reserved.,https://www.ettoday.net,11/13/2024 12:20:52
news_0264884316adb4d430375ba7f4d21298,川普是商人不利台灣？謝志偉：應擔心舔中賤台的「台灣傷人」,政治新聞,2024-11-06T11:51:00Z,隨著2024美國總統大選開票進入尾聲，共和黨候選人川普拿下277張選舉人票，確定當選回鍋白宮執政，也讓人關心台美關係變化。對此，我駐德代表謝志偉認為，台灣是「川菜」，也就是川普的菜，加上川普是個商人，因此更會知道沒有什麼比讓中國拿到台灣更傷害美國利益的，直言台灣要擔心的不是美國商人，而是不時在舔中賤台的「台灣傷人」。,https://www.ettoday.net/news/20241106/2849949.htm,2011 ETtoday.net. All Rights Reserved.,https://www.ettoday.net,11/13/2024 12:20:52
news_1f7e5538ae72bda7dc43b664d97d9e46,美台國防工業會議登場》韓儒伯促美增加對台軍售,政治新聞,2024-09-23T21:30:00Z,"〔記者黃靖媗／台北報導〕「美台國防工業會議」於美東時間廿二日於美國費城揭幕，會議將討論反制灰色地帶策略、強化台灣威嚇防禦力等五大議題。美台商業協會指出，美國對台灣軍力現代化的支持度自二○二一年以來一直在減弱；會長韓儒伯認為，美國對台軍售應該要增加，或保持在特定水準以上。
會中討論台灣安全等五大議題…",https://news.ltn.com.tw/news/politics/paper/1668559,自由時報,https://news.ltn.com.tw/list/breakingnews/politics,10/01/2024 12:23:00
news_64ca526777fb1b30d89e1df7893b06a3,川普再提台灣應付保護費 卓榮泰：台美關係發展良好,國內政治,2024-10-29T02:26:56Z,（中央社記者王揚宇台北29日電）美國共和黨總統候選人川普（Donald Trump）日前受訪時再次提及，台灣若要美國保護，就應該支付保護費。行政院長卓榮泰今天說，台美關係發展良好，相信美國的民主選舉能夠順利，之後會持續深化、加強台美之間的關係。,https://www.cna.com.tw/news/aipl/202410290050.aspx,中央通訊社,https://www.cna.com.tw/list/aipl.aspx,11/05/2024 12:22:34
news_72e2a82462ab618dfcb30265a4e933a1,川普稱台灣搶走晶片生意 卓榮泰：不同意這種說法,國內政治,2024-10-29T03:25:03Z,（中央社記者王承中台北29日電）美國共和黨總統候選人川普稱「台灣搶走晶片生意」，行政院長卓榮泰、經濟部長郭智輝，今天同聲表達不同意川普的說法。卓榮泰表示，半導體是台灣自己發展出來，並領先世界的產業。政府會持續關注美國大選，相信未來台美關係會更加深化。,https://www.cna.com.tw/news/aipl/202410290082.aspx,中央通訊社,https://www.cna.com.tw/list/aipl.aspx,11/05/2024 12:22:34
news_2c967f40f181bff8d1ed7195f0ac0b14,努力發展多元綠能 卓揆：2030前滿足半導體AI高電量,政治新聞,2024-10-29T02:10:31Z,台電核三廠二號機明年5月將除役，外界關切政府能源配比如何分配。行政院長卓榮泰今（29）日表示，依據「核子反應器設施管制法」，核三廠二號機明年5月必須停下，政府目前最大努力的...…,https://news.ltn.com.tw/news/politics/breakingnews/4845150,自由時報,https://news.ltn.com.tw/list/breakingnews/politics,11/05/2024 12:22:34
news_d2d3352197a3e7f328650b547670a85e,美國大選在即　卓榮泰：相信美國主要政黨對美台關係有絕對高度共識,政治新聞,2024-10-29T02:21:00Z,美國總統大選舉辦在即，共和黨候選人川普25號再提台灣搶走美國晶片產業，要求台灣付保護費，外界呼籲台灣政府應跟川普團隊澄清。對此，行政院長卓榮泰今（29日）表示，台美之間雙方基於相同理念的民主同盟，過去到現在的關係，發展都非常的良好，「我也相信美國的主要政黨對美台關係的認知跟未來的發展，是有絕對高度的共識」。,https://www.ettoday.net/news/20241029/2844163.htm,2011 ETtoday.net. All Rights Reserved.,https://www.ettoday.net,11/05/2024 12:22:34
news_780cd169dd284c85a182bfc05e4e7711,川普控台灣偷走晶片產業！　卓榮泰備詢表態：我當然不同意,政治新聞,2024-10-29T03:50:00Z,美國共和黨總統候選人川普批台灣偷走美國的晶片生意。國民黨立委王鴻薇今（29日）質詢時針對此事要求行政院長卓榮泰及經濟部長郭智輝表態，郭智輝說，「川普的說法……是他講的啦！」卓榮泰也說，「我當然不同意，這是我們自己發展出來一個非常領先世界的產業」。,https://www.ettoday.net/news/20241029/2844261.htm,2011 ETtoday.net. All Rights Reserved.,https://www.ettoday.net,11/05/2024 12:22:34
news_e2fb2f3bb24ce54ba5bf4b87052f5b46,范斯：對美而言 台灣比烏克蘭還重要,政治新聞,2024-10-28T21:30:00Z,"〔政治中心／綜合報導〕中央社報導，美國共和黨副總統候選人范斯廿六日在一段Podcast節目上，質疑烏克蘭對美國戰略利益的重要性，並且直言生產晶片的台灣比烏克蘭更重要，萬一中國拿下台灣，對我們真的很不利。
范斯是美國共和黨總統候選人川普的副手搭檔。基輔獨立報報導，范斯在「提姆狄倫秀」（The Tim…",https://news.ltn.com.tw/news/politics/paper/1674392,自由時報,https://news.ltn.com.tw/list/breakingnews/politics,11/05/2024 12:22:34
news_dc09f0a1342d18f12ca6c7c9507739eb,美戰略模糊反淪中共迫台「破口」 學者馬振坤：新總統須嚴加防範,政治新聞,2024-10-30T08:52:57Z,美國2024年總統大選在即，國防大學中共軍事事務研究所教授馬振坤今直言，美國長期在台海採取的「戰略模糊」無法有效嚇阻中共近年來持續對台施壓的灰區行動（又稱灰色地帶行動），當中共...…,https://news.ltn.com.tw/news/politics/breakingnews/4847044,自由時報,https://news.ltn.com.tw/list/breakingnews/politics,11/06/2024 12:31:04
news_356fcbcd5f353a731f830caceb32ce63,幕後／國安單位預告「中國啟動對台操作美選」　含押寶說等5主題,政治新聞,2024-11-04T03:00:00Z,美國總統大選進入最後倒數階段，台灣的國安單位官員近日預判，中共對台操作可歸納成5大敘事主題，包括：押寶說、未掌握說、棄子說、台灣不再被重視，以及各種美日大選後果說。,https://www.ettoday.net/news/20241104/2847817.htm,2011 ETtoday.net. All Rights Reserved.,https://www.ettoday.net,11/11/2024 12:21:39
news_e43ae206eb35478cd4d863bbcc4a3875,習近平要求拜登「反對」台獨遭拒　他分析美近期動作：紮實台美關係,政治新聞,2024-10-30T02:53:00Z,《路透》29日獨家披露，中國國家主席習近平去年曾要求美國總統拜登，調整談論台獨立場時的措辭，從目前使用的「不支持」改為「反對」台灣獨立，但遭到美方拒絕。對此，民進黨發言人吳崢今（30日）接受新聞放鞭炮節目專訪時表示，「不支持」、「反對」兩者有很大差異，若改為「反對」會被認為是為中國完全背書。吳也提到，拜登最近動作頻頻，包含軍援台灣、軍售及廢除雙重課稅的談判，都顯示拜登希望在任期結束前對台美關係奠定紮實基礎。,https://www.ettoday.net/news/20241030/2844944.htm,2011 ETtoday.net. All Rights Reserved.,https://www.ettoday.net,11/06/2024 12:31:04
news_58430ec52cd5a8b50a1fdf4751be2d34,無論美國大選結果為何 學者寇健文：美中競爭格局不變,政治新聞,2024-10-30T07:57:33Z,美國2024總統大選下週即將舉行，政治大學東亞所特聘教授、國關中心研究員寇健文今（30）日表示，美國大選後的兩岸關係主要可用「口頭善意不變，實際僵局不變」概括，基於大國競爭、地...…,https://news.ltn.com.tw/news/politics/breakingnews/4846943,自由時報,https://news.ltn.com.tw/list/breakingnews/politics,11/06/2024 12:31:04
news_d9f5e53ec900524d105a1c4c168f575c,林佳龍：台納入美多邊戰略架構 盼日扮演更重要角色【專訪】,國內政治,2024-10-11T10:23:32Z,（中央社記者游凱翔、楊堯茹台北11日電）長年倡議「亞洲版北約」的日本首相石破茂上任，在地緣政治緊張之際，備受關注。外交部長林佳龍今天表示，石破茂近期開始參加各種國際活動，都透露出希望為日本發展走出一條制度性的解決方案，台灣會特別關注，也期待日本在印太地區、第一島鏈的和平扮演更重要角色。,https://www.cna.com.tw/news/aipl/202410110312.aspx,中央通訊社,https://www.cna.com.tw/list/aipl.aspx,10/18/2024 12:20:57
news_f8de5db43dc57d419a043e6fd9c0ee93,美大選無論誰勝出 學者：美中競爭格局不變,政治新聞,2024-10-30T21:30:00Z,〔記者方瑋立／台北報導〕美國總統大選下週投票揭曉，政治大學東亞所特聘教授、國關中心研究員寇健文昨表示，無論選舉結果為何，美國大選後的兩岸關係可用「口頭善意不變，實際僵局不變」概括，美中競爭格局也難出現結構性改變。國防大學中共軍事事務研究所教授馬振坤則指出，美國長期戰略模糊政策無法有效嚇阻中共灰色地帶…,https://news.ltn.com.tw/news/politics/paper/1674692,自由時報,https://news.ltn.com.tw/list/breakingnews/politics,11/07/2024 12:24:51
news_b501028c3bd0e8f54c88c4fd00d2af0d,「美國總統大選」政權博弈　未來全球的命運轉折點,政治新聞,2024-11-04T08:00:00Z,2024年美國總統大選即將揭曉，這場選舉不僅將決定美國未來四年政策方向，也將對「全球經濟」和「環境政策」產生深遠影響。在民主黨的賀錦麗（Kamala Harris）與共和黨的川普（Donald Trump）之間的角逐中，兩位候選人的政策立場截然不同，可能導致截然不同的國際局勢和市場反應。本文將探討這場選舉潛在正負影響，特別是對原油價格、環境政策及國際關係的影響。,https://www.ettoday.net/news/20241104/2848080.htm,2011 ETtoday.net. All Rights Reserved.,https://www.ettoday.net,11/11/2024 12:21:39
news_6055ebe77448edb8a3a2f968851675c6,美大選在即 卓榮泰：台美關係持續強化應沒問題,國內政治,2024-11-01T10:45:24Z,（中央社記者范正祥台北1日電）立委質詢關注美國總統大選在即，以及選舉結果對台灣的可能影響。行政院長卓榮泰今天表示，台美關係長年來往良性發展，而且是快速穩定當中，未來美國透過民主選舉產生民主政府，台美關係持續強化應該沒有問題。,https://www.cna.com.tw/news/aipl/202411010355.aspx,中央通訊社,https://www.cna.com.tw/list/aipl.aspx,11/08/2024 12:29:53
news_36498ad60b8ca43620aaea4bb19764a5,美國大選 卓榮泰：台美關係一定會持續發展,國內政治,2024-11-05T05:29:40Z,（中央社記者范正祥台北5日電）立委質詢關注美國總統大選，以及選舉結果對台灣的可能影響。行政院長卓榮泰今天表示，他沒有能力預測美國大選結果，但台美關係一定會持續發展。,https://www.cna.com.tw/news/aipl/202411050155.aspx,中央通訊社,https://www.cna.com.tw/list/aipl.aspx,11/12/2024 12:20:31
news_3438c0770ffd0e54eacc2afad0769622,川普勝選  政院：續與美國政府深化台美關係,國內政治,2024-11-06T12:19:40Z,（中央社記者賴于榛台北6日電）美國共和黨總統候選人、前總統川普宣布勝選。行政院今天晚間指出，政府會持續強化各項合作，與具有共同民主價值理念的美國政府一同深化台美關係。,https://www.cna.com.tw/news/aipl/202411060407.aspx,中央通訊社,https://www.cna.com.tw/list/aipl.aspx,11/13/2024 12:20:52
news_6f794a1f495361b5be60a28466583111,吳思瑤控藍白搞民主政變　許宇甄打臉：美國政府因預算停擺22次,政治新聞,2024-11-01T07:43:00Z,總預算六度卡關，行政院長卓榮泰今（1日）赴立法院114年度中央政府總預算案進行並備詢。針對民進黨立委吳思瑤質詢時表示，「在野黨透過擴權、搶錢、沒收民權、摧毀憲法、杯葛總預算案，進行隱形民主政變。」國民黨立委許宇甄痛批，民進黨才是復辟納粹主義，以美國為例，美國國會預算程序於1976年正式執行以來，美國政府一共停擺過22次，在川普擔任總統期間就有三次總預算卡關造成政府關門，若吳思瑤的說法成立，美國早已經政變22次。,https://www.ettoday.net/news/20241101/2846726.htm,2011 ETtoday.net. All Rights Reserved.,https://www.ettoday.net,11/08/2024 12:29:53
news_bf141139af169dc8f2576cb262ed831d,林佳龍接受美媒專訪：台灣和國際社會在同一條船上,國內政治,2024-10-13T10:58:32Z,（中央社記者楊堯茹台北13日電）美國雜誌「國家評論」9日刊出外交部長林佳龍與外交部政次吳志中專訪，林佳龍於專訪指出，台灣能在國際社會及「網格狀安全架構」發揮重要角色，中國所構成的威脅不只針對台灣，對世界也是如此，「我們都在同一條船上」。,https://www.cna.com.tw/news/aipl/202410130185.aspx,中央通訊社,https://www.cna.com.tw/list/aipl.aspx,10/20/2024 12:23:15
news_dea2abadbc0573f39955916a3559d120,谷立言：美國防產業鏈 優先與台合作,政治新聞,2024-11-02T21:30:00Z,"NHK專訪 指美方樂見賴政府加大投資防衛韌性
〔記者方瑋立／台北報導〕美國共和黨總統候選人川普日前稱台灣應將一○％GDP投入國防經費掀起話題。美國在台協會（AIT）處長谷立言近期受訪時強調，台灣已較去年增加八％國防預算，美國樂見賴政府不僅增加國防開支，更廣泛投資其他領域的防衛韌性，也對賴清德總統所…",https://news.ltn.com.tw/news/politics/paper/1675228,自由時報,https://news.ltn.com.tw/list/breakingnews/politics,11/10/2024 12:28:00
news_a76671bcc6f884d0f8783924bea9c7f9,陸軍109旅傳槍響 顧立雄：新兵撿訓練用空包彈擊發,國內政治,2024-11-05T02:00:24Z,（中央社記者陳俊華台北5日電）媒體報導，陸軍109旅龍華營區廁所傳槍響。國防部長顧立雄今天說，在基地訓練戰術測考期間，基於實戰化需求都會配發步槍，新兵是撿到訓練用空包彈在廁所內射擊，「槍並不是他去偷來的」。,https://www.cna.com.tw/news/aipl/202411050036.aspx,中央通訊社,https://www.cna.com.tw/list/aipl.aspx,11/12/2024 12:20:31
news_7413d2a42edc99ad7193f86cce0240b8,應對貿易戰  管中閔：中國強化區域合作力圖經濟復甦,國內政治,2024-11-04T07:54:01Z,（中央社記者楊堯茹台北4日電）美國總統大選5日投票，台灣大學前校長管中閔今天表示，美國新任總統對中國仍會採強硬立場，美中貿易戰恐加劇，中國將尋求強化國際及區域合作，力圖經濟復甦，台灣需思考出口與產業多元化的次戰略作為因應。,https://www.cna.com.tw/news/aipl/202411040186.aspx,中央通訊社,https://www.cna.com.tw/list/aipl.aspx,11/11/2024 12:21:39
news_0dedad6df525c2929c3ce02999dd4e8b,川普要台灣繳保護費？ 李文忠：應是指提高國防經費、增加軍購,政治新聞,2024-11-04T11:28:53Z,美國明日將舉行總統大選，民主黨候選人賀錦麗（Kamala Harris）與共和黨候選人川普（Donald Trump）誰會出線，受到各界關注。國防安全研究院執行長李文忠今（4）...…,https://news.ltn.com.tw/news/politics/breakingnews/4852305,自由時報,https://news.ltn.com.tw/list/breakingnews/politics,11/11/2024 12:21:39
