識別碼,新聞標題,新聞分類,發布日期,新聞前言,新聞連結,來源媒體,來源媒體連結,資料更新時間
news_ee7b967c5ca4c670d994731660c86576,蔡英文愛犬、總統級外交官Maru過世　昔因「隱身術」爆紅,政治新聞,2024-08-20T04:55:00Z,前總統蔡英文的愛犬Maru於19日離世，這是Bella在去年過世後，她在一年裡痛失的第二位家人。Maru是蔡英文三隻導盲犬中最活潑的，曾經因為太開心暴衝，差點讓蔡英文摔跤；而祂最被外界關注，是在2020年時，蔡英文在官邸宴請美國國務次卿柯拉克（Keith Krach），Maru身為「總統級外交官」在拍照時因為無心的「隱身術」而爆紅。,https://www.ettoday.net/news/20240820/2800934.htm,2011 ETtoday.net. All Rights Reserved.,https://www.ettoday.net,08/27/2024 12:19:59
news_ceac437cbfc9a633cdda1ec7ea46dfdb,學者：川普若重返白宮 美中戰略競爭仍將持續,國內政治,2024-08-02T03:59:22Z,（中央社記者吳書緯台北2日電）美國大選正熱，學者盧政鋒認為，若共和黨總統候選人川普勝選，美中戰略競爭的發展格局仍將延續，北京若再次測試華府防衛台海的決心與底線，美國與中國的戰略競爭可能走出拜登政府的管控競爭、建立護欄，走向贏得戰略勝利的方向。,https://www.cna.com.tw/news/aipl/202408020068.aspx,中央通訊社,https://www.cna.com.tw/list/aipl.aspx,08/09/2024 12:18:56
news_93b98a83ea34cfa824d72786d114cf94,民調：台韓多數人認為 美總統不論誰當選都會協防,國內政治,2024-08-02T04:37:23Z,（中央社記者石秀娟華盛頓1日電）一份新民調顯示，超過半數台灣民眾認為，萬一台海衝突，不論誰當選美國總統，美國都會協助台灣；在此同時，逾7成南韓民眾說，無論誰贏，萬一南北韓衝突，美國都會保衛南韓。這份民調在美國總統拜登退選前進行。,https://www.cna.com.tw/news/aipl/202408020098.aspx,中央通訊社,https://www.cna.com.tw/list/aipl.aspx,08/09/2024 12:18:56
news_470834b90901c1d62353edd4c894a145,美國大選將登場 卓榮泰：對台美關係健康永續有信心,政治新聞,2024-11-05T04:18:25Z,美國總統大選稍晚即將登場，行政院長卓榮泰今（5）日答詢時表示，美國是民主成熟的國家，對台美關係朝向健康永續穩定地發展有信心有把握，政策上如果有任何轉變，國家也一定會有相應對策。...…,https://news.ltn.com.tw/news/politics/breakingnews/4852840,自由時報,https://news.ltn.com.tw/list/breakingnews/politics,11/12/2024 12:20:31
news_2749cd392d3922dd1fcdd5422c350c9c,外交部：川普首次執政對台政策正面進展 將推動延續,國內政治,2024-11-06T13:57:51Z,（中央社記者楊堯茹台北6日電）美國總統候選人川普已獲得超過270張選舉人票，篤定成為新任總統。外交部表示，川普首次執政造就台美關係顯著正面進展，將審慎努力推動其延續，且台美各項合作已建置化，不受政府更迭影響。,https://www.cna.com.tw/news/aipl/202411060439.aspx,中央通訊社,https://www.cna.com.tw/list/aipl.aspx,11/13/2024 12:20:52
news_4a830d602531b41ede1b30d6973ed63c,美台商會評拜登最新一波軍售 指無助台軍事現代化,國內政治,2024-09-18T00:24:09Z,（中央社記者鍾佑貞華盛頓17日專電）美國最新對台軍售包括戰機相關設備的備件維修。美台商會會長韓儒伯今天指出，軍售項目延續拜登穩定提供小額彈藥的趨勢，但2020年以來，美國對台灣軍隊現代化的支持已經停止，不利台灣因應所有突發事件。,https://www.cna.com.tw/news/aipl/202409180021.aspx,中央通訊社,https://www.cna.com.tw/list/aipl.aspx,09/25/2024 12:19:24
news_52ddbeeb37cff5de15b240b53f3c9c31,賀錦麗版黨綱重提一中政策　藍委：賴清德上任3個月處處充滿危機,政治新聞,2024-08-21T04:36:00Z,美國民主黨全國代表大會19日通過2024年版黨綱，在「中國」的專章中，首度將對台「六項保障」放入黨綱，也恢復原被刪除的「一中政策」，強調兩岸、台海不會片面改變現狀。對此，國民黨立委李彥秀表示，賴清德上任剛滿三個月，不論在兩岸外交，以及黨務國政上，處處充滿權力危機感，若將嚴肅的兩岸與國際問題，視為大內宣的工具，這往往是災難的開始。,https://www.ettoday.net/news/20240821/2801662.htm,2011 ETtoday.net. All Rights Reserved.,https://www.ettoday.net,08/28/2024 12:22:09
news_c874a7d4e380f18218337274e932f9ce,央行穩定房市2劇本推演　台經院：不排除第7波選擇性信用管制,政治新聞,2024-08-26T05:53:00Z,國內房市升溫，央行大動作請國銀喝咖啡，下達不動產貸款減降令，台經院產經資料庫研究總監暨研究員劉佩真認為，不排除央行祭出第7波選擇性信用管制，可能會有2套劇本，第1是擴大範圍，第2為貸款成數再降。,https://www.ettoday.net/news/20240826/2804689.htm,2011 ETtoday.net. All Rights Reserved.,https://www.ettoday.net,09/02/2024 12:19:27
news_ed51ab9c5342401705628fd4f736f4f2,美民主黨綱首納對台6項保證 國民黨：顯示重視台海未來局勢,政治新聞,2024-08-21T08:22:39Z,美國民主黨於美東時間19日通過2024年版黨綱，首納對台6項保證。國民黨文傳會主委、立委李彥秀今天說，顯示美國對台海未來局勢的重視，美國總統拜登今年就曾多次強調，希望台海兩岸維...…,https://news.ltn.com.tw/news/politics/breakingnews/4775891,自由時報,https://news.ltn.com.tw/list/breakingnews/politics,08/28/2024 12:22:09
news_71a7a6a4933b910a10d1299acf6bc18c,楊西崑訪談錄揭密 曾提議「中華台灣共和國」,國內政治,2024-09-28T07:26:08Z,（中央社記者溫貴香台北28日電）國史館出版前外交部次長楊西崑訪談錄，揭露1971年退出聯合國以後，楊西崑希望美方幫忙說服時任總統蔣中正以「中華台灣共和國」的新名義聲明與大陸完全無關。國史館長陳儀深表示，此事雖無結果，但提議這種跳脫框架的方案為國謀出路，饒富歷史意義。,https://www.cna.com.tw/news/aipl/202409280122.aspx,中央通訊社,https://www.cna.com.tw/list/aipl.aspx,10/05/2024 12:18:53
news_a95aba0c58eabaeba7dbff4d2021b8f4,川普控中國的晶片來自台灣 李忠憲憂資安、晶片國安失策的代價,政治新聞,2024-09-11T21:48:47Z,"首次上稿 9-11 22:32更新時間 9-12 05:48
祝蘭蕙／核稿編輯
美國總統大選倒數2個月，共和黨候選人川普（Donald Trump）、民主黨候選人賀錦麗（Ka...…",https://news.ltn.com.tw/news/politics/breakingnews/4797530,自由時報,https://news.ltn.com.tw/list/breakingnews/politics,09/19/2024 12:19:21
news_3df756a239fedc9d3286d29c00102926,華郵：教官人力及設備短缺 拖慢台灣強化備戰進展,國內政治,2024-08-04T00:32:03Z,（中央社記者鍾佑貞華盛頓3日專電）「華盛頓郵報」今天報導，台灣國防部長顧立雄近期表示，設備及教官不足，使後備軍人訓練專業化的相關作為進度緩慢。報導也說，今年服兵役的人數不足，未能接受操作無人機、刺針飛彈等新式訓練。,https://www.cna.com.tw/news/aipl/202408040022.aspx,中央通訊社,https://www.cna.com.tw/list/aipl.aspx,08/11/2024 12:17:48
news_fef954b9258cc75deb4f8adb157d747f,馬英九：軍購若像繳保護費 國防預算將成錢坑法案,國內政治,2024-08-04T11:25:01Z,（中央社記者呂欣憓曼谷4日專電）前總統馬英九今天在曼谷演講表示，備戰有其必要，但高昂軍費對台灣是沉重的負擔，尤其若軍購變成美國總統候選人川普口中繳保護費的輕蔑說法，國防預算等於錢坑法案，會拖垮台灣的財政，只會圖利美國的軍工複合體。,https://www.cna.com.tw/news/aipl/202408040190.aspx,中央通訊社,https://www.cna.com.tw/list/aipl.aspx,08/11/2024 12:17:48
news_d8bcc2a03394a9061db38cf9b3af2047,彭斯旗下組織促共和黨 堅定挺台抗中,政治新聞,2024-08-20T21:30:00Z,"「推動美國自由」暗批川普對台政策 強調「今日台灣，明日關島」 
〔編譯陳成良／綜合報導〕美國前副總統彭斯創立的政策倡議組織「推動美國自由」（AAF），上週發布一份備忘錄，強調台灣在抗衡中國侵略中的重要性，敦促共和黨國會議員堅定支持台灣。這份報告引發外界廣泛關注，被視為對前總統川普相關言論的間接回應…",https://news.ltn.com.tw/news/politics/paper/1662776,自由時報,https://news.ltn.com.tw/list/breakingnews/politics,08/28/2024 12:22:09
news_c92f1f8869faed651ba51392f847bf14,美前副總統投書華郵拒孤立主義 強調台灣不能淪陷,國內政治,2024-08-22T00:18:31Z,（中央社記者鍾佑貞華盛頓21日專電）川普6月受訪指台灣與美國距離遠，要協防台灣高度困難。川普任內的副總統彭斯及共和黨大老佛訥今天反駁這種說法，質疑「對全球超級強國來說，距離算什麼呢？」強調美國必須確保台灣的自由及安全。,https://www.cna.com.tw/news/aipl/202408220022.aspx,中央通訊社,https://www.cna.com.tw/list/aipl.aspx,08/29/2024 12:21:33
news_eb76097ac112e5b593d932922fdb5a5e,美前官員：川普「量化」台美關係 賀錦麗重結盟,國內政治,2024-08-22T03:26:32Z,（中央社記者鍾佑貞華盛頓21日專電）美國白宮之戰鹿死誰手，牽動全球政經。前白宮官員何瑞恩指出，賀錦麗預計將循拜登重視聯盟固台海路線，川普側重可量化的事務例如軍費。副手組方面，華茲以人為本，關切台灣人心聲，范斯重視台海更勝歐洲。,https://www.cna.com.tw/news/aipl/202408220080.aspx,中央通訊社,https://www.cna.com.tw/list/aipl.aspx,08/29/2024 12:21:33
news_94047a0425bb8cb1e5a46040da253b1d,「兩岸問題兩岸自己解決」　馬英九：沒有美國或是他國介入空間,政治新聞,2024-08-04T07:25:00Z,前總統馬英九近日出席泰國中華會館第27屆「中山講座」並發表演說，針對美中台關係，馬英九呼籲美國以及關心臺灣的國際友人，要鼓勵臺灣與大陸對話，這是對各方以及區域安全最有利的方式，「根據我們與大陸的憲法，兩岸同屬一個中國，所以兩岸問題理應由兩岸自己談，不可能也不應該假手他人」，喊話民進黨政府要認清現實，美國不可能為了台灣，犧牲自己的子弟，兩岸若發生戰火，死傷的都是兩岸的中國人。,https://www.ettoday.net/news/20240804/2790778.htm,2011 ETtoday.net. All Rights Reserved.,https://www.ettoday.net,08/11/2024 12:17:48
news_b58250e28e532b5f2ce4a035ed2b4218,川普、賀錦麗都不願出兵援台　王鴻薇：賴清德該告知國人真相,政治新聞,2024-10-20T04:37:00Z,美國共和黨總統候選人川普日前接受華爾街日報採訪時說，如果中國「進入台灣」，將對中國徵收額外的關稅。國民黨立委王鴻薇今（20日）對此表示，美國不管是現任總統，到未來的總統候選人，沒人願意具體承諾，中國入侵台灣時美國能夠出兵援助台灣，因此「政府還是應該努力維持台海和平。」,https://www.ettoday.net/news/20241020/2838694.htm,2011 ETtoday.net. All Rights Reserved.,https://www.ettoday.net,10/27/2024 12:18:38
news_cdd2ef1fa73ad034449960c1e6cc3098,中共侵台川普只會「加徵關稅」　李彥秀：賴清德要擬定對策因應,政治新聞,2024-10-20T05:03:00Z,美國總統大選共和黨籍候選人川普日前接受專訪時表示，若當選後中共對台灣動武，將對中國大陸課150%至200%關稅，對是否出兵援台則模糊帶過。國民黨立委李彥秀今（20日）指出，賴清德總統與國安單位應視為警訊，提早擬定對策因應，不能再以「認知作戰」輕輕帶過。,https://www.ettoday.net/news/20241020/2838701.htm,2011 ETtoday.net. All Rights Reserved.,https://www.ettoday.net,10/27/2024 12:18:38
news_5c0a7570ad00eca17a5d77db881e120d,協防台灣不怕遠！彭斯駁川普：對超級強國「算什麼呢」？,政治新聞,2024-08-22T01:45:44Z,"川普6月受訪指台灣與美國距離遠，要協防台灣高度困難。川普任內的副總統彭斯及共和黨大老佛訥今天反駁這種說法，質疑「對全球超級強國來說，距離算什麼呢」？強調美國必須確保台灣的自由及安全。

...…",https://news.ltn.com.tw/news/politics/breakingnews/4776490,自由時報,https://news.ltn.com.tw/list/breakingnews/politics,08/29/2024 12:21:33
news_3f8e088baca81b19af5133439f91718c,馬英九稱軍購若像保護費將成錢坑法案  綠：貽笑國際,國內政治,2024-08-05T06:03:33Z,（中央社記者王揚宇、林敬殷台北5日電）前總統馬英九稱軍購若像繳保護費，國防預算將成錢坑法案。對於馬英九的說法，民進黨立法院黨團幹事長吳思瑤今天受訪質疑，各國編列國防預算都是錢坑法案嗎，馬英九的講法真的是貽笑大方、貽笑國際。,https://www.cna.com.tw/news/aipl/202408050140.aspx,中央通訊社,https://www.cna.com.tw/list/aipl.aspx,08/12/2024 12:19:04
news_c4234e0776656fc2e1f9247310089ff6,拜會美國行政立法部門  國民黨：闡述國防外交政策,國內政治,2024-09-29T05:30:09Z,（中央社記者王承中台北29日電）國民黨國際部主任黃介正、國民黨立委徐巧芯等人，日前赴美出席美台國防工業會議，並轉往華府拜會美國行政部門、國會及智庫。黃介正今天表示，明確向美方傳達國民黨守護台海和平的堅定立場，並透過23場深度對談，闡述國民黨的國防和外交政策。,https://www.cna.com.tw/news/aipl/202409290101.aspx,中央通訊社,https://www.cna.com.tw/list/aipl.aspx,10/06/2024 12:19:59
news_b9ba8315d3734c209b17d2d263e58e62,賀錦麗與川普大不同 民主黨基層喻「光明與黑暗」,國內政治,2024-08-23T11:24:11Z,（中央社記者石秀娟芝加哥23日專電）民主黨全代會22日結束，期間黨內政治明星輪番助講，許多人都不免提到民主黨候選人賀錦麗與共和黨候選人川普的「對比再明顯不過了」。多名黨代表說，兩人帶來的正負能量猶如「光明與黑暗」。,https://www.cna.com.tw/news/aipl/202408230331.aspx,中央通訊社,https://www.cna.com.tw/list/aipl.aspx,08/30/2024 12:17:46
news_ef190975246f526edb00873cffb48fb7,國民黨訪美14天23場官學界對談　論台美軍事合作國防預算與投資順序,政治新聞,2024-09-29T03:42:00Z,國民黨國際部主任黃介正偕立法委員徐巧芯、空軍退役中將田在勱日前出席賓州費城舉辦的「美台國防工業會議」（U.S.-Taiwan Defense Industry Conference）後，再返華盛頓特區拜會美國行政部門、國會、智庫，並與大華府地區華僑餐敘，共14天馬拉松式行程，於昨日返台。,https://www.ettoday.net/news/20240929/2825742.htm,2011 ETtoday.net. All Rights Reserved.,https://www.ettoday.net,10/06/2024 12:19:59
news_fc350f4461f97dc4638f55c0c8df08aa,馬稱若繳保護費國防預算是錢坑 綠反批：勿丟國家和自己的臉,政治新聞,2024-08-05T04:36:22Z,前總統馬英九近日於泰國曼谷演講時提及，若軍購變成美國總統候選人川普口中繳「保護費」的說法，國防預算等於是錢坑法案。對此，立法院外交及國防委員會民進黨籍召委王定宇批評，不曉得馬的...…,https://news.ltn.com.tw/news/politics/breakingnews/4759208,自由時報,https://news.ltn.com.tw/list/breakingnews/politics,08/12/2024 12:19:04
news_010aca2cd0a6cef26efc26817b9b1239,駁馬英九稱國防預算是錢坑 白委林憶君：確保台灣「嚇阻力量」必要作為,政治新聞,2024-08-05T06:22:24Z,前總統馬英九近日於泰國曼谷演講時稱，若軍購變成美國總統候選人川普口中繳「保護費」的說法，國防預算等於是錢坑法案，會拖垮台灣的財政。對此，民眾黨立委林憶君表示，台灣當前所面對的威...…,https://news.ltn.com.tw/news/politics/breakingnews/4759316,自由時報,https://news.ltn.com.tw/list/breakingnews/politics,08/12/2024 12:19:04
news_54f3ff499c920f943dadf554edd6255d,綠轟馬「繳保護費變錢坑法案」說法 馬辦：國防預算創新高有更安全？,政治新聞,2024-08-05T08:47:09Z,前總統馬英九近日於泰國中華會館演說時提到，「備戰有其必要，但高昂軍費對台灣來說是沉重的負擔，尤其若軍購變成美國總統候選人川普口中繳『保護費』的荒謬、輕蔑說法，國防預算等於是錢坑...…,https://news.ltn.com.tw/news/politics/breakingnews/4759503,自由時報,https://news.ltn.com.tw/list/breakingnews/politics,08/12/2024 12:19:04
news_fe2eaa7d988739e31bbd801e3e3877bc,馬英九「繳保護費變錢坑法案」說法挨轟 藍委林沛祥緩頰,政治新聞,2024-08-05T09:32:00Z,前總統馬英九近日於泰國演說，其中提到的「繳保護費變錢坑法案」說法，被綠營抨擊丟自己和國家的臉，對此，國民黨立委林沛祥今日受訪表示，可以理解馬英九的憂慮，因為就算繳了保護費，美方...…,https://news.ltn.com.tw/news/politics/breakingnews/4759577,自由時報,https://news.ltn.com.tw/list/breakingnews/politics,08/12/2024 12:19:04
news_f631987253c6fe4f4ca4e0fecfc9127c,14天狂掃美國23個重要單位 國民黨：明確向美傳達國防外交政策,政治新聞,2024-09-29T03:32:39Z,國民黨代表團昨日結束14天美國訪問行程返台，國民黨國際部主任黃介正今日指出，黨代表團這14天和美國行政部門、國會參眾兩院、重要智庫學者，以及美國總統候選人川普、賀錦麗兩大競選陣...…,https://news.ltn.com.tw/news/politics/breakingnews/4814463,自由時報,https://news.ltn.com.tw/list/breakingnews/politics,10/06/2024 12:19:59
news_97d15edbf252185b4c90de08979f1bc0,國民黨桃園市議員耍官威！　訪美「購物時間不夠」飆罵外交官,政治新聞,2024-08-05T22:20:00Z,外交部7月中籌組跨黨派代表團赴美觀選，竟鬧出藍營民代羞辱外交官風波！本刊接獲爆料，國民黨主席朱立倫愛將、身兼國民黨智庫副執行長的桃園市議員凌濤，隨團赴美參加共和黨全國代表大會後，竟以行程偏心執政黨、購物時間不夠為由，對著我國外交官痛罵，一名年輕外交人員事後甚至在機上泣不成聲，凌濤耍官威的行徑讓外館及台僑社團埋下不滿情緒，連藍營青年團代表都私下向駐處致歉，恐讓正規劃訪美的朱立倫徒增困擾。,https://www.ettoday.net/news/20240806/2791636.htm,2011 ETtoday.net. All Rights Reserved.,https://www.ettoday.net,08/13/2024 12:18:30
news_62d0472e321bf82a6ce7c9cec4dc8524,幕後／凌濤飆罵外交官2原因曝　訪團成員緩頰：有瑕疵但綠營是好意,政治新聞,2024-08-06T04:11:00Z,外交部7月中旬籌組跨黨派代表團赴美，參加共和黨全國代表大會，今（6日）國民黨智庫副執行長凌濤卻被爆出，在過程中因不滿購物時間不夠，痛罵我國外交官。據了解，代表團團長前一日就邀請在野黨成員與美政要共進晚餐，藍白則選擇按原定行程在芝加哥千禧公園附近逛街採購，而凌濤因不滿購物時間短、更因行程分兩邊壓縮到晚餐時間而大發雷霆，當面痛罵外交部隨團人員，連在野黨成員都緩頰稱，民進黨的安排是好意，雖然辦事處的安排確實有些許瑕疵，「但犯不著發這麼大脾氣。」,https://www.ettoday.net/news/20240806/2791820.htm,2011 ETtoday.net. All Rights Reserved.,https://www.ettoday.net,08/13/2024 12:18:30
news_bfe08f34c56d53844cbf4a766e4c58f5,從炸北京到「保護費」 川普對台立場反覆利益至上,國內政治,2024-08-11T01:20:39Z,（中央社記者鍾佑貞華盛頓10日專電）美國大選正熱，兩黨民調持續拉鋸，舉凡北約及日本都在因應川普重返白宮的可能性，台灣也不例外。從放話中國攻台就要炸北京，到要台灣砸錢「買」美國協防來看，川普的反覆是日常，國際觀重實利輕價值。,https://www.cna.com.tw/news/aipl/202408110040.aspx,中央通訊社,https://www.cna.com.tw/list/aipl.aspx,08/18/2024 12:18:25
news_3a22eda2df7f0733ea04471dc0078ae6,美總統大選倒數！　沈富雄曝驚人分析：若川普贏傾向賣一半股票,政治新聞,2024-10-21T04:36:00Z,美國總統大選進入倒數階段，將於11月5日登場，民主黨推派現任美國副總統賀錦麗，共和黨則由前總統川普出馬，雙方持續激戰。對此，前立委沈富雄昨（20日）分析，自己本來認為賀錦麗穩贏，但最近這2、3天，賀錦麗民調掉了3到4個百分點，現在有一點危險。他認為，如果投票前夕，兩邊不相上下，或是川普明顯領先，他自己傾向賣掉一半股票，因為他很害怕川普當選。,https://www.ettoday.net/news/20241021/2839115.htm,2011 ETtoday.net. All Rights Reserved.,https://www.ettoday.net,10/28/2024 12:20:51
news_8cd4d562e2694aef926df58a7812a63a,若繳保護費 國防預算是錢坑？ 綠委批馬：勿丟國家和自己的臉,政治新聞,2024-08-05T21:30:00Z,〔記者謝君臨、林哲遠、林欣漢／台北報導〕前總統馬英九近日於泰國曼谷演講時提及，若軍購變成美國總統候選人川普口中繳「保護費」的說法，國防預算等於是錢坑法案。對此，立院外交及國防委員會民進黨籍召委王定宇批評，不曉得馬的立論基礎為何？是不要國防投資、不要採購軍備，還是不要繳「保護費」？奉勸不要丟自己和國家…,https://news.ltn.com.tw/news/politics/paper/1660352,自由時報,https://news.ltn.com.tw/list/breakingnews/politics,08/13/2024 12:18:30
news_98eae18ef756d417a73fd97c96ff4aff,海利肯定賴政府保護人民決心 挺台加入美國防供應鏈,國內政治,2024-08-24T06:44:43Z,（中央社記者楊堯茹台北24日電）美國前駐聯合國大使、曾角逐美國共和黨總統提名的海利22日與總統賴清德會面。海利今天表示，對賴總統的誠實、勇敢以及保護人民的決心印象深刻，且致力提升經濟、照顧人民；對於台灣加入美國國防供應鏈，她說，「這是很好且必須發生的合作。」,https://www.cna.com.tw/news/aipl/202408240103.aspx,中央通訊社,https://www.cna.com.tw/list/aipl.aspx,08/31/2024 12:19:17
news_dec70906878e58250b33550047b0b401,卓：對台美關係健康永續有信心,政治新聞,2024-11-05T21:30:00Z,"〔記者方瑋立、陳政宇、謝君臨／台北報導〕美國總統大選五日投票，行政院長卓榮泰昨答詢說，美國是民主成熟的國家，對台美關係朝向健康永續穩定地發展有信心和把握，政策上如果有任何轉變，國家也一定會有相應對策。
立委關切美大選 林佳龍：不管誰勝出 都會依法確保台海和平
外交部長林佳龍也強調，美國基於「台灣…",https://news.ltn.com.tw/news/politics/paper/1675632,自由時報,https://news.ltn.com.tw/list/breakingnews/politics,11/13/2024 12:20:52
news_a89b7b67010cddbf62046a66bb0b0121,獨／藍營反咬綠訪團跟大麻商吃飯　餐敘照片曝光「全是大咖美政要」,政治新聞,2024-08-07T07:55:00Z,外交部7月中旬籌組跨黨派代表團赴美，參加共和黨全國代表大會，過程中，國民黨智庫副執行長的桃園市議員凌濤被爆因不滿行程偏心執政黨、購物時間不夠，痛罵我國外交官。而藍營不滿遭到爆料，反咬綠營赴大麻供應商邀約的僑宴。據《ETtoday新聞雲》記者掌握當天晚宴照片，當天確實有多位美國政要與會，包含伊利諾州州眾議員Theresa Mah、Hoan Huynh、參議院議員Senator Willie Preston、杜佩奇郡郡議會議員Lucy Chang Evans。民進黨與會訪團成員認為，都是同一團的，對內可以競爭,https://www.ettoday.net/news/20240807/2792814.htm,2011 ETtoday.net. All Rights Reserved.,https://www.ettoday.net,08/14/2024 12:18:37
news_06f1ec4ea128fe7fa5a9d90e7e2d8c22,台灣比想像中更閃耀 李忠憲：不應等外人來告訴我們台灣的好,政治新聞,2024-10-21T11:55:21Z,"莊文仁／核稿編輯
當前台灣朝野對立嚴重，藍白時常唱衰台灣，導致部分民眾認為台灣不過爾爾，不過台灣身為全球少數能夠在威權壓力下維持民主自由的國家之一，所擁抱的一切在外人看來卻彌足珍...…",https://news.ltn.com.tw/news/politics/breakingnews/4837723,自由時報,https://news.ltn.com.tw/list/breakingnews/politics,10/28/2024 12:20:51
news_0d28c106ea177c46b579f6da807589e1,華郵專欄作家專訪 川普指台灣國防預算應占GDP10%,國內政治,2024-09-30T23:10:02Z,（中央社記者石秀娟華盛頓30日專電）美國共和黨總統候選人川普近期受訪，就台海安全議題指出，中國終究會攻打台灣，但不會在他任內發生。他認為台灣的國防支出不夠，應該提高到國內生產毛額的10%。,https://www.cna.com.tw/news/aipl/202410010013.aspx,中央通訊社,https://www.cna.com.tw/list/aipl.aspx,10/08/2024 12:23:26
