識別碼,新聞標題,新聞分類,發布日期,新聞前言,新聞連結,來源媒體,來源媒體連結,資料更新時間
news_188e86a1463dab0e20b06f9910f9fba3,昔日「恩人」拒背書 賀錦麗總統之路再添變數,國際新聞,2024-08-27T13:12:47Z,美國副總統賀錦麗（Kamala Harris）的總統競選之路再添變數。根據福斯新聞（Fox News）26日報導，曾在賀錦麗參選聯邦參議員時扮演重要角色的蒙大拿州聯邦參議員泰斯...…,https://news.ltn.com.tw/news/world/breakingnews/4782097,自由時報,https://news.ltn.com.tw/list/breakingnews/world,09/03/2024 12:19:39
news_a8c61fbd1d2214bc0cde71e1adebbd7f,隔空對嗆! 賀批滿腦政敵 川諷細漢的,國際新聞,2024-10-25T21:30:00Z,"〔編譯張沛元／綜合報導〕美國民主黨總統候選人、副總統賀錦麗與共和黨總統候選人、前總統川普廿四日分別在搖擺州的競選場上向對方開嗆，其中與前總統歐巴馬合體造勢的賀錦麗批評川普無心造福人民，川普則狂罵賀錦麗在管控非法移民上無能，就算當選也會被中國國家主席習近平當成「細漢的」。
賀合體歐巴馬喬州造勢
賀…",https://news.ltn.com.tw/news/world/paper/1673914,自由時報,https://news.ltn.com.tw/list/breakingnews/world,11/02/2024 12:27:06
news_b3dedfc4fd9136a78dd9ae21cc4166e7,歐巴馬赴搖擺州賓州幫賀錦麗催票 鎖定年輕人,國際焦點,2024-10-11T03:20:57Z,（中央社匹茲堡10日綜合外電報導）美國前總統歐巴馬在賓州匹茲堡大學校園舉行的集會上，情緒激昂地表達反對共和黨總統候選人川普、支持民主黨籍副總統賀錦麗的看法，目的是激勵年輕人11月5日出門投票。,https://www.cna.com.tw/news/aopl/202410110070.aspx,中央通訊社,https://www.cna.com.tw/list/aopl.aspx,10/18/2024 12:21:53
news_32b0930e600a680e6b17046daa6fabfe,俄亥俄州海地移民吃狗論 當地選民半數不信、24%認為是真的,國際焦點,2024-10-11T03:50:19Z,（中央社記者鍾佑貞華盛頓10日專電）美國總統大選，共和黨總統候選人川普及副手范斯大炒俄亥俄州海地移民吃貓狗論，掀起反移民風暴連帶引發炸彈威脅。華盛頓郵報民調顯示，當地選民有57%不信吃貓狗論，16%不確定，24%認為這話可能或一定是真的。,https://www.cna.com.tw/news/aopl/202410110080.aspx,中央通訊社,https://www.cna.com.tw/list/aopl.aspx,10/18/2024 12:21:53
news_3076b8daaaae35dd748d146a4280bb23,賀錦麗公布副手人選 明尼蘇達州長華茲出線,國際新聞,2024-08-06T16:52:16Z,"相關新聞請見︰
賀錦麗副手華茲曾在中國教書 籲不應遺忘六四
賀錦麗副手華茲 從教室到政壇的跨界領袖
賀錦麗副手華茲出線！ 川普陣營：美國噩夢
賀錦麗副手華茲年輕時曾來台傳教  關心西藏香港人權...…",https://news.ltn.com.tw/news/world/breakingnews/4760778,自由時報,https://news.ltn.com.tw/list/breakingnews/world,08/14/2024 12:17:18
news_86b0195fded9254d21ac9c0036299a1f,賀錦麗副手華茲曾在中國教書 籲不應遺忘六四,國際新聞,2024-08-06T16:14:26Z,"相關新聞請見︰
賀錦麗公布副手人選 明尼蘇達州長華茲出線
賀錦麗副手華茲 從教室到政壇的跨界領袖
賀錦麗副手華茲出線！ 川普陣營：美國噩夢
賀錦麗副手華茲年輕時曾來台傳教  關心西藏香港人權
...…",https://news.ltn.com.tw/news/world/breakingnews/4761092,自由時報,https://news.ltn.com.tw/list/breakingnews/world,08/14/2024 12:17:18
news_f60527feb3799145f31b1779dbb40811,美前總統卡特將迎百歲大壽 期待票投賀錦麗,國際焦點,2024-08-22T07:45:32Z,（中央社華盛頓21日綜合外電報導）美國前總統卡特10月1日將歡度百歲華誕。他的孫子今天表示，比起百歲大壽，卡特更想要投票給民主黨總統候選人賀錦麗。,https://www.cna.com.tw/news/aopl/202408220224.aspx,中央通訊社,https://www.cna.com.tw/list/aopl.aspx,08/29/2024 12:21:41
news_9e1ec06733863b5dd6cf5999b968cd56,"華茲成賀錦麗副手 共和黨有人鬆口氣有人批惡夢
",國際新聞,2024-08-06T17:51:03Z,"明尼蘇達州州長華茲成為賀錦麗副手，川普本人發了條有「感謝丞相賜箭」意味的推文，川普競選團隊則連發聲明抨擊華茲當州長時想把明尼蘇達州重塑為加州，「賀錦麗及華茲的加州夢是每個美國人的惡夢」。
...…",https://news.ltn.com.tw/news/world/breakingnews/4761099,自由時報,https://news.ltn.com.tw/list/breakingnews/world,08/14/2024 12:17:18
news_c34f896cd7e9507e59d3bb344f5308e6,賀錦麗副手華茲年輕時曾來台傳教  關心西藏香港人權,國際新聞,2024-08-06T19:12:03Z,"相關新聞請見︰
賀錦麗公布副手人選 明尼蘇達州長華茲出線
賀錦麗副手華茲曾在中國教書 籲不應遺忘六四
賀錦麗副手華茲 從教室到政壇的跨界領袖
賀錦麗副手華茲出線！ 川普陣營：美國噩夢

〔...…",https://news.ltn.com.tw/news/world/breakingnews/4761113,自由時報,https://news.ltn.com.tw/list/breakingnews/world,08/14/2024 12:17:18
news_710c12f3a532b469ba611cdf7503c316,拜登挺賀錦麗藏心機　金主曝：對逼宮者說Fxxk you,國際新聞,2024-07-22T21:50:00Z,美國總統拜登21日突然宣布退選消息，對各界投下震撼彈，他更表態支持副手賀錦麗接棒參選2024；然而，身為拜登幕後金主之一的佛州律師摩根（John Morgan）表態「不會為賀錦麗募款」，並指出拜登之所以為賀錦麗背書，其實就是在對所有逼宮他的人說「Fxxk you」。,https://www.ettoday.net/news/20240723/2782556.htm,2011 ETtoday.net. All Rights Reserved.,https://www.ettoday.net,07/30/2024 12:18:47
news_5e9c8928be73c802eca15df5020a4889,煽動暴力嫌疑！　共和黨議員嗆：川普敗選恐掀美國內戰,國際新聞,2024-07-23T00:02:00Z,美國共和黨副總統候選人范斯（JD Vance）家鄉俄亥俄州的參議員喬治連（George Lang），22日在競選大會上竟然說，川普2024如果敗選，「恐怕會引發內戰」。此話一出隨即遭到炎上，民主黨現任副總統、總統候選人賀錦麗團隊也緊急呼籲，川普與范斯應公開譴責喬治連的聳動發言。,https://www.ettoday.net/news/20240723/2782581.htm,2011 ETtoday.net. All Rights Reserved.,https://www.ettoday.net,07/30/2024 12:18:47
news_4accda6b6b1a89da6b0091b08cec8929,川普副手范斯嗆「拜登最爛總統」：賀錦麗比他爛100萬倍,國際新聞,2024-07-23T00:49:00Z,美國副總統賀錦麗接棒總統拜登，成為民主黨內呼聲最大的總統參選人選。日前成為川普搭檔的共和黨參議員范斯（JD Vance），在他集會上學川普抨擊拜登是「史上最爛總統」，而賀錦麗比拜登爛100萬倍。,https://www.ettoday.net/news/20240723/2782591.htm,2011 ETtoday.net. All Rights Reserved.,https://www.ettoday.net,07/30/2024 12:18:47
news_2a60a042e154912a1c819ee55b7d913c,歐巴馬未表態挺賀錦麗　紐時：前2屆大選與拜登埋下心結,國際新聞,2024-07-23T00:31:00Z,美國總統拜登宣布退選並點名副總統賀錦麗接棒後，民主黨政治人物紛紛表態支持，但黨內關鍵人物、前總統歐巴馬迄今仍未公開相挺。美媒分析，歐巴馬此舉除為保持中立、超然形象，也擔心傷害拜登的自尊。,https://www.ettoday.net/news/20240723/2782593.htm,2011 ETtoday.net. All Rights Reserved.,https://www.ettoday.net,07/30/2024 12:18:47
news_daa3715df12fdfa35a2436d427856541,媒體描繪「川普不友台只在乎錢」　美YouTuber拍片反駁,國際新聞,2024-07-23T01:00:00Z,共和黨總統參選人川普近期對台灣議題談話引發議論。住台灣的美國YouTuber鎖吶檢視川普受訪全文、過去發言、任內官員對台立場，反駁媒體把川普描繪為對台不友善、只在乎錢的報導。,https://www.ettoday.net/news/20240723/2782604.htm,2011 ETtoday.net. All Rights Reserved.,https://www.ettoday.net,07/30/2024 12:18:47
news_76495aa8a22d3160057aff2406ee13d2,美特勤局長認了！　川普遇槍擊是「數十年來最重大失敗」,國際新聞,2024-07-23T03:51:00Z,美國特勤局局長奇鐸（Kimberly Cheatle）表示，共和黨總統候選人川普遭槍擊是特勤局數十年來最嚴重的行動失敗，她將為此負起全責，但拒絕請辭。,https://www.ettoday.net/news/20240723/2782606.htm,2011 ETtoday.net. All Rights Reserved.,https://www.ettoday.net,07/30/2024 12:18:47
news_f15c1c27a3223cf21eeb84d33ee65f90,馬斯克驚呆！美家庭年收「前10都是少數族裔」　台灣排第2,國際新聞,2024-07-23T01:41:00Z,特斯拉執行長馬斯克（Elon Musk）在社群網站X上分享了一份美國人口普查局2018年的數據，顯示台灣裔家庭在美國的家庭收入中位數中排名第2，僅次於印度裔家庭，且從第1至第11名都是少數族裔，讓他驚呼，「美國真的是個機會之地！」更有網友發現，美國官方將「台灣裔」與「中國裔」分開計算。,https://www.ettoday.net/news/20240723/2782628.htm,2011 ETtoday.net. All Rights Reserved.,https://www.ettoday.net,07/30/2024 12:18:47
news_b5e4ace6d8bc3dafc6a2778a8fdc0c76,逼宮拜登內幕曝光！　傳民主黨大老威脅：不退選就罷免總統,國際新聞,2024-07-23T01:50:00Z,美國總統拜登21日閃電宣布退選，儘管詳細原因並未公開，但是外傳他是遭到黨內「逼宮」。《紐約郵報》則引述內部人士消息報導，民主黨高層曾威脅拜登，如果他不主動退選，則將直接罷免他的總統職位，使得頑強抵抗數周的拜登，最終決定親口宣布退選。,https://www.ettoday.net/news/20240723/2782629.htm,2011 ETtoday.net. All Rights Reserved.,https://www.ettoday.net,07/30/2024 12:18:47
news_c9d300629267fcc3bc39c589f8e7a268,川普拿下民主黨大票倉！　最新民調「微幅領先」賀錦麗,國際新聞,2024-07-23T06:37:00Z,美國新罕布夏州是民主黨的鐵票倉，自2000年代以來就從未有共和黨籍的總統候選人在此獲勝，然而最新民調卻顯示，川普以些微差距領先可能代替拜登出馬的賀錦麗，有望在此贏得4張選舉人票。,https://www.ettoday.net/news/20240723/2782640.htm,2011 ETtoday.net. All Rights Reserved.,https://www.ettoday.net,07/30/2024 12:18:47
news_6ed45db016205736866d81cd3df3ec18,《辛普森家庭》撞衫賀錦麗神預言！　編劇回應了,國際新聞,2024-07-23T05:48:00Z,美國經典動畫《辛普森家庭》以褒貶時事聞名，過去也曾「神預言」各種國際大事，而近來有網友發現，美國副總統賀錦麗有可能代表民主黨參選總統，似乎也被《辛普森家庭》預測中，就連其中一名編劇都貼文表示，「很榮幸能成為『辛普森預言』的一份子。」,https://www.ettoday.net/news/20240723/2782648.htm,2011 ETtoday.net. All Rights Reserved.,https://www.ettoday.net,07/30/2024 12:18:47
news_e884aa0a6c078973ce8379cb95ccb282,和拜登通話內容曝光　川普再談槍擊案：我拒絕使用擔架,國際新聞,2024-07-23T02:34:00Z,美國前總統川普在22日播出的福斯新聞專訪中提及賓州造勢槍擊事件時說，拜登事後有打電話過來關心，「他說，『你很幸運，有把頭轉向右邊』」。他透露，耳朵傷勢已經好多了，如果當初大螢幕上沒有那張圖表，他就不會轉頭，如果沒轉頭，就會發生很糟的事，且在台上耳朵濺血之後，他拒絕使用擔架。,https://www.ettoday.net/news/20240723/2782665.htm,2011 ETtoday.net. All Rights Reserved.,https://www.ettoday.net,07/30/2024 12:18:47
news_6a82684436414ef6d3ae4f4357afb33e,美聯社：賀錦麗已獲足夠代表票　民主黨最晚8月7日提名,國際新聞,2024-07-23T02:09:00Z,美國總統拜登21日宣布退出總統競選，副總統賀錦麗臨危受命上陣代打。如今，美聯社非官方統計顯示，賀錦麗已爭取到夠多的代表票，可獲得民主黨總統候選人提名，而民主黨也表示，最遲將在8月7日提名總統候選人。,https://www.ettoday.net/news/20240723/2782681.htm,2011 ETtoday.net. All Rights Reserved.,https://www.ettoday.net,07/30/2024 12:18:47
news_a6199234497b15cbc14a5fe08cb71a6b,賀錦麗幾乎篤定獲提名！　外媒盤點4可能副手人選,國際新聞,2024-07-23T07:44:00Z,美國總統拜登宣布退選後，公開支持副總統賀錦麗（Kamala Harris）接棒。《美聯社》非官方統計顯示，目前賀錦麗已獲得至少2214人的支持，幾乎篤定能代表民主黨參選，而民主黨最晚將在8月7日提名總統候選人，《美聯社》也整理出可能擔任賀錦麗副手的4名人選。,https://www.ettoday.net/news/20240723/2782973.htm,2011 ETtoday.net. All Rights Reserved.,https://www.ettoday.net,07/30/2024 12:18:47
news_9ba992f4f76c217f5dfb3546572a79c8,喬治王子11歲了！好日子倒數　將面臨「殘酷成長挑戰」,國際新聞,2024-07-23T07:15:00Z,英國喬治王子（Prince Geroge）22日度過11歲生日，媽媽凱特王妃（Kate Middleton）依照慣例為他拍攝西裝帥照，可見他越發成熟穩重。不過，喬治總有一天會成為國王，隨著他長大，要肩負起責任也越來越重。王室專家指出，當喬治年滿12歲時，他要面臨「殘酷的成長挑戰」，將不能再與父親威廉王子（Prince William）一起旅行，以保護王室繼承順序的安全。,https://www.ettoday.net/news/20240723/2783012.htm,2011 ETtoday.net. All Rights Reserved.,https://www.ettoday.net,07/30/2024 12:18:47
news_5e1316384168b28e3178affbb3db3bdd,國際火線／邪惡兼平庸：總統拜登的「七宗罪」,國際新聞,2024-07-23T11:51:00Z,今年已經81歲的拜登，成長與茁壯時代形塑而成的是冷戰思維，腦子裡全是「抗蘇」、「打共匪」的想法。更糟的是，他當上總統後還是只會搞這一套，而是還認為自己很行，做得好棒棒！結果是害慘了天下人。自他上任至今三年多犯下的的罪行一椿椿，屈指難數，舉其大者，至少有以下數椿。,https://www.ettoday.net/news/20240723/2783202.htm,2011 ETtoday.net. All Rights Reserved.,https://www.ettoday.net,07/30/2024 12:18:47
news_78a06227807d4f5cf1d3022d850331ee,快訊／川普遇刺「堅持不下台」！美特勤局長突改口請辭,國際新聞,2024-07-23T14:49:00Z,美國前總統川普13日遇襲震驚各界，特勤局（Secret Service）局長齊特爾（Kimberly Cheatle）15日承認「責任在我身上」，但無意引咎辭職。沒想到，齊特爾23日突然宣布請辭。,https://www.ettoday.net/news/20240723/2783294.htm,2011 ETtoday.net. All Rights Reserved.,https://www.ettoday.net,07/30/2024 12:18:47
news_7cfbd18919871e14cc0a5ab5fc7e932d,華茲是誰？ 美媒民調：71％美國人沒聽過賀錦麗副手,國際新聞,2024-08-07T00:46:29Z,"蔡百靈／核稿編輯
美國民主黨總統候選人、現任副總統賀錦麗（Kamala Harris）6日宣布競選搭檔為明尼蘇達州州長華茲（Tim Walz），兩人也在賓州天普大學首場競選活動中...…",https://news.ltn.com.tw/news/world/breakingnews/4761143,自由時報,https://news.ltn.com.tw/list/breakingnews/world,08/14/2024 12:17:18
news_6983916cba4ef80a34ee0e5d8729277f,巴基斯坦男子涉嫌計畫暗殺川普 遭美司法部起訴,國際新聞,2024-08-07T04:04:50Z,"莊文仁／核稿編輯
根據週二公佈的法庭文件，一名與伊朗政府有關的巴基斯坦男子因涉嫌計畫刺殺前美國總統川普（Donald Trump）和其他美國政客而被美國司法部起訴。

據《C...…",https://news.ltn.com.tw/news/world/breakingnews/4761357,自由時報,https://news.ltn.com.tw/list/breakingnews/world,08/14/2024 12:17:18
news_806baa2b3742db9d59a1905d8fc2f471,賀錦麗與副手華茲在費城首度同台 已收到6.54億捐款,國際新聞,2024-08-07T05:15:47Z,"李欣潔／核稿編輯
民主黨籍總統參選人、美國副總統賀錦麗（Kamala Harris）宣布副手人選，明尼蘇達州州長華茲（Tim Walz）成為其搭檔，在當地時間6日晚上兩人首度同台...…",https://news.ltn.com.tw/news/world/breakingnews/4761426,自由時報,https://news.ltn.com.tw/list/breakingnews/world,08/14/2024 12:17:18
news_308a7065fd10d7aad16b048bce261df2,賀錦麗選錯搭檔？ 自由派媒體人士質疑其政治判斷,國際新聞,2024-08-07T04:46:55Z,美國副總統賀錦麗（Kamala Harris）6日宣布選擇明尼蘇達州州長華茲（Tim Walz）作為其2024年總統大選的競選搭檔，此舉在美國政界和媒體圈引發了廣泛討論和爭議。...…,https://news.ltn.com.tw/news/world/breakingnews/4761463,自由時報,https://news.ltn.com.tw/list/breakingnews/world,08/14/2024 12:17:18
news_f544ee7b4aac434c32dabc3520143b5f,狂人王見王！ 川普宣布：8/12將接受馬斯克採訪,國際新聞,2024-08-07T05:20:27Z,"李欣潔／核稿編輯
美國共和黨總統候選人川普自爆，他將在12日（週一）接受美國億萬富翁、特斯拉執行長馬斯克（Elon Musk）的訪問，詳情尚待公布。

據《路透》報導，川普...…",https://news.ltn.com.tw/news/world/breakingnews/4761516,自由時報,https://news.ltn.com.tw/list/breakingnews/world,08/14/2024 12:17:18
news_c9d0edfad10dba829186fd3fc838930e,北約秘書長呂特：烏克蘭可合法打擊俄羅斯境內目標,國際新聞,2024-10-11T01:07:00Z,北大西洋公約組織（NATO）新任秘書長呂特（Mark Rutte）今天在訪問英國期間表示，就法律層面而言，烏克蘭可打擊俄羅斯境內目標，至於是否允許烏方使用西方軍援武器這麼做，交由個別國家決定。,https://www.ettoday.net/news/20241011/2833097.htm,2011 ETtoday.net. All Rights Reserved.,https://www.ettoday.net,10/18/2024 12:21:53
news_01e1a337ed26f391dccd9c3642c73228,美總統大選最新民調 川普在3搖擺州領先,國際新聞,2024-09-24T02:12:05Z,"黃其豪／核稿編輯
距離11月美國總統大選僅剩一個半月，民主黨候選人賀錦麗與共和黨候選人川普的選情空前膠著，根據最新民調指出，川普在3個關鍵搖擺州領先賀錦麗，這些搖擺州包含亞利桑那...…",https://news.ltn.com.tw/news/world/breakingnews/4808986,自由時報,https://news.ltn.com.tw/list/breakingnews/world,10/01/2024 12:18:39
news_0d4f22742dfd6730d673034456e4e8ec,川普選戰火力全開！藍州、紅州、搖擺州 全面出擊爭取勝選,國際新聞,2024-09-24T01:19:43Z,美國總統大選進入倒數計時關鍵時刻，前總統川普（Donald Trump）宣布將加強選戰活動，不僅將重點放在搖擺州，更將觸角延伸至藍州和紅州，以爭取更多選票，並展現其強大的動員能...…,https://news.ltn.com.tw/news/world/breakingnews/4809005,自由時報,https://news.ltn.com.tw/list/breakingnews/world,10/01/2024 12:18:39
news_f49b8555ff63b7b7b8870373b859202e,賀錦麗提名演說恰逢結婚紀念日 與夫婿PO文示愛放閃,國際焦點,2024-08-22T22:34:09Z,（中央社芝加哥22日綜合外電報導）美國副總統賀錦麗今天將正式接受民主黨提名角逐總統大位，準備發表政治生涯迄今最重大的演說，而今天也是她與夫婿任德龍結婚10週年紀念日，兩人不忘在社群媒體X互道愛意。,https://www.cna.com.tw/news/aopl/202408230014.aspx,中央通訊社,https://www.cna.com.tw/list/aopl.aspx,08/30/2024 12:18:59
news_947bd297de86d746bc73fc2d00116800,賀錦麗將發表全代會壓軸演說 碧昂絲可能站台表演,國際焦點,2024-08-23T02:21:06Z,（中央社芝加哥22日綜合外電報導）美國副總統賀錦麗在經歷美國政治史上意想不到的轉折後，今天將在芝加哥接受民主黨提名，並承諾成為「所有美國人的總統」，矢言要走「新道路向前邁進」。,https://www.cna.com.tw/news/aopl/202408230040.aspx,中央通訊社,https://www.cna.com.tw/list/aopl.aspx,08/30/2024 12:18:59
news_fa0127103bfb3ebb78f7d7ef38505068,賀錦麗多族裔身分 反映美國人口演變趨勢,國際焦點,2024-08-23T02:56:27Z,（中央社芝加哥22日綜合外電報導）美國民主黨總統候選人賀錦麗（Kamala Harris）的父親來自牙買加，母親生於印度，兩人都是移民，賀錦麗的出身反映出美國不斷變化的人口組成。,https://www.cna.com.tw/news/aopl/202408230050.aspx,中央通訊社,https://www.cna.com.tw/list/aopl.aspx,08/30/2024 12:18:59
news_468b83be00107d93641b82f4dad61ce7,賀錦麗全代會演說放閃 祝丈夫結婚10週年快樂,國際焦點,2024-08-23T03:28:52Z,（中央社芝加哥22日綜合外電報導）美國副總統賀錦麗（Kamala Harris）今天在民主黨全國代表大會發表演說，開場時先祝她的丈夫任德龍（Doug Emhoff）結婚10週年快樂，任德龍也大方回送飛吻。,https://www.cna.com.tw/news/aopl/202408230062.aspx,中央通訊社,https://www.cna.com.tw/list/aopl.aspx,08/30/2024 12:18:59
news_e94991e4a884db969c373a2fdb624710,賀錦麗批川普不正經 選他當總統後果極為嚴重,國際焦點,2024-08-23T04:00:38Z,（中央社芝加哥22日綜合外電報導）美國副總統賀錦麗（Kamala Harris）今天在民主黨全國代表大會（DNC）最後一天登台接受提名角逐總統，她稱川普是不正經的人，選他當總統引發的後果將極為嚴重。,https://www.cna.com.tw/news/aopl/202408230084.aspx,中央通訊社,https://www.cna.com.tw/list/aopl.aspx,08/30/2024 12:18:59
news_a4fffe21925f361776a5a169e9d71a9e,賀錦麗民主黨全代會展現大團結氣勢 喊話做全民總統為百姓而戰[影],國際焦點,2024-08-23T04:02:40Z,（中央社記者鍾佑貞華盛頓22日專電）民主黨多位大咖鋪陳3天後，賀錦麗今天正式「加冕」，成為美國首位亞非裔女性總統候選人，全力拚戰11月大選。她登場時展現大團結氣勢，向各路人馬掛保證將成為所有美國人的總統，自始至終為百姓而戰。,https://www.cna.com.tw/news/aopl/202408230085.aspx,中央通訊社,https://www.cna.com.tw/list/aopl.aspx,08/30/2024 12:18:59
news_84acf377993e5b0e02416a5866fadffa,賀錦麗全代會演說 警告別讓川普帶美國走回頭路,國際焦點,2024-08-23T04:41:25Z,（中央社芝加哥22日綜合外電報導）美國副總統賀錦麗今天在芝加哥的民主黨全國代表大會登台演說時警告，如果前總統川普再度入主白宮，他將帶領美國走回危險政策之路。,https://www.cna.com.tw/news/aopl/202408230107.aspx,中央通訊社,https://www.cna.com.tw/list/aopl.aspx,08/30/2024 12:18:59
news_57b208b6788ae95f987171f30bd1e4d0,加州川粉動員向民主黨嗆聲 高喊「川普寶貝加油」,國際焦點,2024-08-23T04:47:39Z,（中央社記者張欣瑜、實習記者葉芳妤舊金山22日專電）美國副總統賀錦麗今天接受民主黨提名。上百名川普支持者同天聚集加州灣區嗆聲，以船隻遊行方式砲轟民主黨，有人身穿印有川普遭槍擊時振臂歡呼照的T恤激動高喊，「我們受夠了」、「川普寶貝加油」。,https://www.cna.com.tw/news/aopl/202408230114.aspx,中央通訊社,https://www.cna.com.tw/list/aopl.aspx,08/30/2024 12:18:59
news_4fbed753a0e27a2dc0c6765f2ef69d4f,民主黨全代會網紅雲集 借助社群影響力催票,國際焦點,2024-08-23T05:31:19Z,（中央社芝加哥23日綜合外電報導）民主黨總統候選人、美國副總統賀錦麗的競選團隊邀請網紅出席本週舉辦的民主黨全國代表大會（DNC），希望能藉由網紅影響力催票，在11月打敗共和黨總統候選人川普。,https://www.cna.com.tw/news/aopl/202408230133.aspx,中央通訊社,https://www.cna.com.tw/list/aopl.aspx,08/30/2024 12:18:59
news_fa5b1249ac9e2c82224d0ea58176289b,上網揚言對川普不利  亞利桑那州男子遭拘捕,國際焦點,2024-08-23T06:28:07Z,（中央社華盛頓22日綜合外電報導）美國有線電視新聞網（CNN）報導，執法人員表示，亞利桑那州男子西夫魯德（Ronald Syvrud）因涉嫌在社群平台上威脅要殺害前總統川普，目前已遭拘捕。,https://www.cna.com.tw/news/aopl/202408230155.aspx,中央通訊社,https://www.cna.com.tw/list/aopl.aspx,08/30/2024 12:18:59
news_3a2be12f3abea9f27945c2f646015b38,賀錦麗副總統政績爭議一次看 主責非法移民人工智慧與中俄挑戰,國際焦點,2024-08-23T08:06:38Z,（中央社記者石秀娟芝加哥23日專電）美國民主黨總統候選人賀錦麗22日正式接受民主黨提名。她擔任副總統3年多，主責與國家安全相關的任務包括中美洲移民非法跨越美墨邊界、人工智慧運用規範，以及應對中俄發展太空武器的挑戰。,https://www.cna.com.tw/news/aopl/202408230199.aspx,中央通訊社,https://www.cna.com.tw/list/aopl.aspx,08/30/2024 12:18:59
news_161174722b838d313a2a544f68bf849e,賀錦麗全代會演說矢言抗全球暴政 諷川普有金正恩相挺,國際焦點,2024-08-23T09:54:29Z,（中央社芝加哥22日綜合外電報導）美國副總統賀錦麗正式接受民主黨提名為總統候選人，她在全國代表大會中慷慨激昂呼籲結束加薩衝突，並且強調要對抗全球各地暴政，與共和黨對手川普形成鮮明對比。,https://www.cna.com.tw/news/aopl/202408230282.aspx,中央通訊社,https://www.cna.com.tw/list/aopl.aspx,08/30/2024 12:18:59
news_a2d5e3b18ebf92696f2315ab89cfe6e2,歐巴馬、歐普拉、約翰傳奇幫賀錦麗催票 美民主黨全代會亮點彙整,國際焦點,2024-08-23T11:09:01Z,（中央社芝加哥22日綜合外電報導）美國民主黨全國代表大會今天晚間落幕，副總統賀錦麗發表獲提名角逐白宮大位的壓軸演說博得滿堂彩，但為期4天冠蓋雲集又洋溢歡愉和希望氛圍的全代會，亮點不只有賀錦麗。,https://www.cna.com.tw/news/aopl/202408230326.aspx,中央通訊社,https://www.cna.com.tw/list/aopl.aspx,08/30/2024 12:18:59
