識別碼,新聞標題,新聞分類,發布日期,新聞前言,新聞連結,來源媒體,來源媒體連結,資料更新時間
news_ca0d3f01f12ea75c9f4bbb1cb56dcfc2,川普、賀錦麗首場辯論 各界評論家看法分歧,國際新聞,2024-09-11T04:41:46Z,美國前總統川普與副總統賀錦麗（Kamala Harris）於 9 月 10 日晚間，在賓州費城舉行首場總統大選辯論。辯論結束後，《新聞週刊》（Newsweek）邀請多位作家和評...…,https://news.ltn.com.tw/news/world/breakingnews/4796781,自由時報,https://news.ltn.com.tw/list/breakingnews/world,09/18/2024 12:25:28
news_a519c9335cccf662cd8c7e61d7b8ad52,反轉拜登陰霾！ CNN辯論民調：63％受訪者認為賀錦麗表現更佳,國際新聞,2024-09-11T05:33:45Z,"劉家凱／核稿編輯
美國總統大選辯論結束，《CNN》民調顯示有63％受訪者認為民主黨候選人賀錦麗表現較佳，只有37％認為共和黨候選人川普表現較好，和川普、拜登先前的辯論民調完全相...…",https://news.ltn.com.tw/news/world/breakingnews/4796835,自由時報,https://news.ltn.com.tw/list/breakingnews/world,09/18/2024 12:25:28
news_a942576f5d37f3896f87f971153fa54f,賀錦麗批前政府把晶片賣給中國  川普稱晶片來自台灣,國際新聞,2024-09-11T06:27:50Z,"郭顏慧／核稿編輯
美國民主黨候選人賀錦麗（Kamala Harris）在10日的總統辯論中提及關稅問題，指控對手川普（Donald Trump）執政期間「出賣了我們」，所推政策「...…",https://news.ltn.com.tw/news/world/breakingnews/4796854,自由時報,https://news.ltn.com.tw/list/breakingnews/world,09/18/2024 12:25:28
news_df5f415e01b064f0c787735861dfc357,很快！泰勒絲歌曲已在賀錦麗集會上播放,國際新聞,2024-09-11T06:15:13Z,"郭顏慧／核稿編輯
美國總統大選辯論結束後，流行天后泰勒絲（Taylor Swift）在Instagram表態支持賀錦麗，而賀錦麗競選團隊動作超快，立刻就在集會上播放泰勒絲的歌曲，...…",https://news.ltn.com.tw/news/world/breakingnews/4796874,自由時報,https://news.ltn.com.tw/list/breakingnews/world,09/18/2024 12:25:28
news_5378998c2faa2056974d2465ebeadced,梅蘭妮亞爆猛料？新書預告片直指川普遇刺案疑點,國際新聞,2024-09-11T07:25:19Z,美國前第一夫人梅蘭妮亞（Melania Trump）即將推出個人回憶錄《梅蘭妮亞》（Melania），然而在新書預告片中，她並未著墨於個人經歷，反而將焦點放在丈夫、前總統川普（...…,https://news.ltn.com.tw/news/world/breakingnews/4796931,自由時報,https://news.ltn.com.tw/list/breakingnews/world,09/18/2024 12:25:28
news_bb1b70ad0eb7e5f982ee0bbc23c0f64d,川普墮胎議題離譜言論哪來的？ 原來是誤會民主黨人說法,國際新聞,2024-09-11T07:35:30Z,"李欣潔／核稿編輯
美國共和黨總統候選人川普在和民主黨候選人賀錦麗辯論時，指稱民主黨支持「讓嬰兒出生後終止生命」，亦即「殺嬰」，旋即被辯論主持人糾正，強調美國沒有任何一州可以合法地...…",https://news.ltn.com.tw/news/world/breakingnews/4796958,自由時報,https://news.ltn.com.tw/list/breakingnews/world,09/18/2024 12:25:28
news_75236acacb947bd2a0fccec97650435a,川普對辯論表現滿意 是否接受二辯取決於電視台「公平性」,國際新聞,2024-09-11T08:31:39Z,美國前總統川普與副總統賀錦麗的首場總統大選辯論落幕，川普隨即接受福斯新聞（Fox News）節目《漢尼提》（Hannity）訪問，暢談辯論心得。川普對自己的表現顯得信心滿滿，更...…,https://news.ltn.com.tw/news/world/breakingnews/4797115,自由時報,https://news.ltn.com.tw/list/breakingnews/world,09/18/2024 12:25:28
news_778f18e3428b8d4c23b63ae014ae84b8,川賀首辯誰贏了？ 美國搖擺州選民這樣說,國際新聞,2024-09-11T10:24:15Z,《華盛頓郵報》在10日美國總統大選候選人電視辯論結束後，就誰輸誰贏即時訪問25名來自搖擺州的未表態選民，結果多達23人認為民主黨總統候選人、副總統賀錦麗表現較佳，其中甚至不乏原...…,https://news.ltn.com.tw/news/world/breakingnews/4797307,自由時報,https://news.ltn.com.tw/list/breakingnews/world,09/18/2024 12:25:28
news_d7f5cc7d824d133c8403f55caaad90f5,川普X受訪談遭槍擊經歷 馬斯克讚展現堅韌性格,國際焦點,2024-08-13T05:31:56Z,（中央社紐約12日綜合外電報導）美國前總統川普今天回到舊稱推特（Twitter）的社群媒體平台X接受訪問，生動談及7月13日險遭暗殺的經歷，當時他的右耳遭子彈擦過，億萬富豪馬斯克稱讚川普展現了勇氣。,https://www.cna.com.tw/news/aopl/202408130144.aspx,中央通訊社,https://www.cna.com.tw/list/aopl.aspx,08/20/2024 12:20:13
news_0b9f431ab4278781a289ec6d0bc5d7ef,川普狂勝賀錦麗！「章魚哥」賓州烘焙坊「餅乾民調」結果曝,國際新聞,2024-09-11T12:39:07Z,美國總統大選進入白熱化階段，兩黨候選人卯足全力爭取選民支持。在賓州這個關鍵搖擺州，一家家族經營的烘焙坊「Lochel's Bakery」再度以其著名的「餅乾民調」預測選情，而這...…,https://news.ltn.com.tw/news/world/breakingnews/4797485,自由時報,https://news.ltn.com.tw/list/breakingnews/world,09/18/2024 12:25:28
news_60b9e338ae0daa54101dacd8326bb8b9,美大選結果誰說的可信？ 民調：共和黨人信任川普甚於政府,國際新聞,2024-09-11T15:12:36Z,美國共和黨總統候選人川普在10日的辯論會上，依然不承認自己輸了上屆大選，並不實指稱該次選舉「被偷」。美聯社與美國民意研究所公共事務研究中心（AP-NORC Center for...…,https://news.ltn.com.tw/news/world/breakingnews/4797613,自由時報,https://news.ltn.com.tw/list/breakingnews/world,09/18/2024 12:25:28
news_fa84858e57b1a723197565c05eb37e09,賀錦麗已郵寄投票　與川普搖擺州分別最後催票,國際新聞,2024-11-03T21:30:00Z,美國副總統賀錦麗今天表示，已寄出老家加州的郵寄選票，完成今年大選投票。她今天在戰場州密西根州一個黑人教會最後催票。共和黨對手川普則在另一搖擺州賓州造勢。,https://www.ettoday.net/news/20241104/2847878.htm,2011 ETtoday.net. All Rights Reserved.,https://www.ettoday.net,11/11/2024 12:21:42
news_e072d787cb97f2f3749530223735981b,馬斯克X平台專訪川普 技術問題部分用戶看不到,國際焦點,2024-08-13T00:49:35Z,（中央社華盛頓12日綜合外電報導）美國共和黨總統候選人川普排定今晚在社群平台X接受億萬富翁馬斯克（Elon Musk）專訪，不過訪談一開始便遭遇技術問題，部分用戶無法加入直播觀看。,https://www.cna.com.tw/news/aopl/202408130019.aspx,中央通訊社,https://www.cna.com.tw/list/aopl.aspx,08/20/2024 12:20:13
news_5fc201b82ebdb54d540d19b8d0c818c2,日美韓防長簽備忘錄 安全合作定期化,國際新聞,2024-07-28T21:30:00Z,"會中討論「台海和平穩定」重要性
〔駐日特派員林翠儀／東京廿八日報導〕為加強在東亞地區的嚇阻力，日本、美國及南韓三國國防部長，廿八日在東京舉行會談，並簽署合作定期化的備忘錄，未來將每年召開高層官員會議，增加三國聯合演訓的次數，以及即時共享北韓飛彈相關情報等。三國防長也在會中討論台灣海峽平和穩定的重要…",https://news.ltn.com.tw/news/world/paper/1658897,自由時報,https://news.ltn.com.tw/list/breakingnews/world,08/05/2024 12:18:34
news_c615c61f3ae5c3aab86314219c2a5117,比照石油 川普︰建立比特幣戰略儲備,國際新聞,2024-07-28T21:30:00Z,"批賀錦麗想摧毀加密貨幣
〔編譯孫宇青／綜合報導〕過去曾對比特幣（Bitcoin）等加密貨幣嗤之以鼻的美國共和黨總統候選人川普，廿七日在一場加密貨幣大會上「擁抱幣圈」，矢言當選後將結束美國政府對加密貨幣的「迫害」，全面放鬆管制，並比照石油建立比特幣國家戰略儲備，讓美國成為「比特幣強權」，不讓中國和其…",https://news.ltn.com.tw/news/world/paper/1658900,自由時報,https://news.ltn.com.tw/list/breakingnews/world,08/05/2024 12:18:34
news_157ccca5ec820f2dab1e0b2394ab368f,與川普對談直播出狀況 馬斯克：遭遇大規模網攻,國際焦點,2024-08-13T03:15:54Z,（中央社洛杉磯12日綜合外電報導）億萬富翁馬斯克（Elon Musk）今天表示，他與共和黨籍總統候選人川普在社群媒體平台X上的訪談遭遇網路攻擊。,https://www.cna.com.tw/news/aopl/202408130057.aspx,中央通訊社,https://www.cna.com.tw/list/aopl.aspx,08/20/2024 12:20:13
news_83ecb06aaa554795e9a6fd38207ae320,馬斯克專訪川普 獻策成立政府效能委員會抗通膨,國際焦點,2024-08-13T04:53:08Z,（中央社記者石秀娟華盛頓12日專電）美國億萬富翁、特斯拉執行長馬斯克力挺共和黨總統候選人川普重回白宮。他今天建議川普當選後成立「政府效能委員會」，檢視政府支出是否合理，並表達自己很願意加入。對此，川普立即表示歡迎。,https://www.cna.com.tw/news/aopl/202408130122.aspx,中央通訊社,https://www.cna.com.tw/list/aopl.aspx,08/20/2024 12:20:13
news_f4e5ecb58ac907e8a56d306924ff833a,FBI查川普團隊遇駭案 國務院警告伊朗勿介入選舉,國際焦點,2024-08-13T06:02:33Z,（中央社華盛頓12日綜合外電報導）美國共和黨總統候選人川普競選團隊自曝內部通訊遭外國駭客入侵、並將矛頭指向伊朗之後，聯邦調查局（FBI）展開調查，國務院今天也警告伊朗，干預選舉將產生後果。,https://www.cna.com.tw/news/aopl/202408130162.aspx,中央通訊社,https://www.cna.com.tw/list/aopl.aspx,08/20/2024 12:20:13
news_5be7283e1a4ebf85ca1ac4bfd54f9ccd,川普陣營推新競選廣告 諷賀錦麗「邊境沙皇」,國際新聞,2024-07-30T15:15:18Z,"吳裕堯／核稿編輯
美國總統大選倒數不到百天，共和黨川普（Donald Trump）陣營與民主黨賀錦麗（Kamala Harris）陣營今（30）日相繼推出競選廣告。川普在廣告中譏...…",https://news.ltn.com.tw/news/world/breakingnews/4753734,自由時報,https://news.ltn.com.tw/list/breakingnews/world,08/06/2024 12:18:35
news_e5373041479b95389c01c1b3a7082051,馬斯克轉發賀錦麗深偽影片！　大喊「太讚了」挨批違反X自家政策,國際新聞,2024-07-30T10:32:00Z,社群平台X的老闆、億萬富豪馬斯克（Elon Musk）日前利用自己的帳號分享副總統賀錦麗的「深偽」影片，招來批評聲浪。科技倡議人士稱馬斯克此舉違反X自家政策。,https://www.ettoday.net/news/20240730/2787693.htm,2011 ETtoday.net. All Rights Reserved.,https://www.ettoday.net,08/06/2024 12:18:35
news_1c3093531748ef7c2e5fb672ebfe61bb,簡訊曝光！川普遇刺前90分鐘 警方已察覺嫌犯,國際新聞,2024-07-29T22:20:47Z,美國福斯新聞網（Fox News）29日披露了震驚全美的刺殺前總統川普未遂事件的新細節。根據最新曝光的執法人員簡訊紀錄，負責監控川普賓州集會的警方早在槍擊發生前90分鐘就已發現...…,https://news.ltn.com.tw/news/world/breakingnews/4752535,自由時報,https://news.ltn.com.tw/list/breakingnews/world,08/06/2024 12:18:35
news_4b59f0f0f690f3ab2f7a7fe5717e863e,賀錦麗公布體檢報告「身心很健康」　78歲川普仍拒絕公布,國際新聞,2024-10-13T00:43:00Z,美國總統大選倒數中，民主黨副總統、59歲候選人賀錦麗12日公布自己的醫療報告，以證明自己身心健康，適合擔任政府要職。與此同時，78歲的共和黨候選人川普卻拒絕這麼做。,https://www.ettoday.net/news/20241013/2834143.htm,2011 ETtoday.net. All Rights Reserved.,https://www.ettoday.net,10/20/2024 12:21:34
news_5cc4b6a084347eebd2900d4b8c69a8f5,川普遇刺照遭標記「經過竄改」 臉書承認錯誤審核,國際新聞,2024-07-30T13:29:28Z,福斯新聞網（Fox News）報導，臉書（Facebook）發言人7月29日承認平台錯誤地將川普遭遇刺殺後舉拳的照片標記為「被竄改的照片」。該照片因其具有歷史意義而廣泛流傳，但...…,https://news.ltn.com.tw/news/world/breakingnews/4753673,自由時報,https://news.ltn.com.tw/list/breakingnews/world,08/06/2024 12:18:35
news_626e0819a6403aa217aacdabb172dda7,巴黎奧運開幕式觸碰宗教敏感神經 川普斥「恥辱」,國際新聞,2024-07-30T04:51:31Z,2024年巴黎奧運會開幕式在7月26日舉行後，因一場被指涉及宗教元素的表演引發軒然大波。前美國總統川普（Donald Trump）於7月29日接受福斯新聞（Fox News）訪...…,https://news.ltn.com.tw/news/world/breakingnews/4752852,自由時報,https://news.ltn.com.tw/list/breakingnews/world,08/06/2024 12:18:35
news_57bcca0444c2507c73ef19a35b851e36,賓州決勝負 川賀辯論登場,國際新聞,2024-09-10T21:30:00Z,〔編譯周虹汶／綜合報導〕美國民主、共和兩黨總統候選人賀錦麗與川普的首場電視辯論，美東時間十日晚間在賓州費城登場。美國有線電視新聞網（CNN）指出，儘管川普身陷數十項刑事指控，但仍有勝選可能性，這場辯論將是賀錦麗闡明政策與外界質疑，也是提出決定性論點阻止川普回鍋白宮的最佳機會，她過去四年不時遭受質疑的…,https://news.ltn.com.tw/news/world/paper/1666442,自由時報,https://news.ltn.com.tw/list/breakingnews/world,09/18/2024 12:25:28
news_c3441097b8f1dfc919bcb6133e3e8ef7,川普痛批ABC假新聞　暗示恐爽約總統大選辯論,國際新聞,2024-08-26T21:57:00Z,美國共和黨總統候選人川普今天痛批美國廣播公司新聞網（ABC News）是假新聞，並且暗示他可能不會參加9月10日由ABC主辦的總統候選人辯論。,https://www.ettoday.net/news/20240827/2804989.htm,2011 ETtoday.net. All Rights Reserved.,https://www.ettoday.net,09/03/2024 12:19:39
news_2a04e618a854e10cde32c0fb4c746ab4,拜登提最高法院3大改革 將修憲明定無人有豁免權,國際焦點,2024-07-30T00:21:43Z,（中央社記者石秀娟華盛頓29日專電）美國總統拜登今天提3大改革最高法院的方向，將修憲納入「任何人不得凌駕法律」條文、立法限制大法官任期、制定大法官操守規範。美國最高法院近年爭議不斷，民調顯示，民眾不滿意度高達6成。,https://www.cna.com.tw/news/aopl/202407300023.aspx,中央通訊社,https://www.cna.com.tw/list/aopl.aspx,08/06/2024 12:18:35
news_07e16de265d40b40d0d1fab345b351fe,賓州造勢大會槍擊案 川普同意接受FBI訪談,國際焦點,2024-07-30T02:22:25Z,（中央社華盛頓29日綜合外電報導）美國聯邦調查局（FBI）官員今天表示，前總統川普已同意與FBI見面，就本月13日發生的企圖暗殺未遂一案，以受害者身分進行訪談。,https://www.cna.com.tw/news/aopl/202407300043.aspx,中央通訊社,https://www.cna.com.tw/list/aopl.aspx,08/06/2024 12:18:35
news_e48e0df6f9b38e01cbab55cb058626bc,情報機構：因應拜登退選 外國介選策略將重新調整,國際焦點,2024-07-30T04:53:55Z,（中央社華盛頓29日綜合外電報導）美國情報官員今天表示，針對11月大選從事影響操作的敵人，預期會根據總統大選的發展進行調整，這顯然是在說拜登放棄競選連任一事。,https://www.cna.com.tw/news/aopl/202407300115.aspx,中央通訊社,https://www.cna.com.tw/list/aopl.aspx,08/06/2024 12:18:35
news_5b471a75df421b1b1784e0237a8c290d,川普砸巨資打廣告戰 試圖壓制賀錦麗上漲氣勢,國際焦點,2024-07-30T06:00:58Z,（中央社華盛頓29日綜合外電報導）美國共和黨總統候選人川普的競選團隊本週將在6個關鍵州發動1000萬美元的廣告攻勢，試圖壓制選民對民主黨對手賀錦麗（Kamala Harris）的高漲熱情及踴躍捐款。,https://www.cna.com.tw/news/aopl/202407300144.aspx,中央通訊社,https://www.cna.com.tw/list/aopl.aspx,08/06/2024 12:18:35
news_b54472de9a891545ab8031da2567cea2,承諾與賀錦麗辯論又跳票？川普回答模稜兩可,國際焦點,2024-07-30T07:44:21Z,（中央社紐約29日綜合外電報導）美國共和黨總統候選人川普先前承諾與副總統賀錦麗辯論，但今天似乎有意食言，他質疑兩人對決的價值，稱他「很可能」會辯論，但「也可提出充分理由不辯論」。,https://www.cna.com.tw/news/aopl/202407300213.aspx,中央通訊社,https://www.cna.com.tw/list/aopl.aspx,08/06/2024 12:18:35
news_a3ed7c3e88e37ef1e4592ce85df6cf2f,范斯「無孩女貓奴」談話掀波 川普：表達重視家庭,國際焦點,2024-07-30T08:21:13Z,（中央社華盛頓30日綜合外電報導）美國前總統川普副手范斯一席副總統賀錦麗是「無孩女貓奴」談話在網路上瘋傳，為共和黨問鼎白宮之路製造麻煩。川普今天力挺范斯，強調他試圖表達對家庭生活的重視。,https://www.cna.com.tw/news/aopl/202407300238.aspx,中央通訊社,https://www.cna.com.tw/list/aopl.aspx,08/06/2024 12:18:35
news_56230415cd058df861bab426c0656893,馬斯克轉發賀錦麗深偽影片 挨批違反X自家政策,國際焦點,2024-07-30T09:09:52Z,（中央社華盛頓29日綜合外電報導）社群平台X的老闆、億萬富豪馬斯克（Elon Musk）日前利用自己的帳號分享副總統賀錦麗的「深偽」影片，招來批評聲浪。科技倡議人士稱馬斯克此舉違反X自家政策。,https://www.cna.com.tw/news/aopl/202407300257.aspx,中央通訊社,https://www.cna.com.tw/list/aopl.aspx,08/06/2024 12:18:35
news_ad090ae6b4f91c58da28bde97cbcd449,川普辯論扯「移民吃寵物」主持人反駁、賀錦麗批極端[影],國際焦點,2024-09-11T02:33:23Z,（中央社華盛頓10日綜合外電報導）美國共和黨總統候選人川普今天在電視轉播總統大選辯論中散布毫無根據的謠言，指稱移民在俄亥俄州春田市（Springfield）吃寵物。,https://www.cna.com.tw/news/aopl/202409110035.aspx,中央通訊社,https://www.cna.com.tw/list/aopl.aspx,09/18/2024 12:25:28
news_01c3fb2aeb28fb73f084ca38ac0da375,川普辯論打強勢外交 內政議題拋移民吃狗保基本盤,國際焦點,2024-09-11T04:05:55Z,（中央社記者鍾佑貞華盛頓10日專電）美國總統大選可能「僅此一場」的辯論登場，川普批賀錦麗政策照抄拜登之際，不忘拋出「移民吃狗」等爭議言論力保基本盤。外交部分則再次將拜登政府形容為弱者，強調由他主政，當前的戰爭短期內就會結束。,https://www.cna.com.tw/news/aopl/202409110079.aspx,中央通訊社,https://www.cna.com.tw/list/aopl.aspx,09/18/2024 12:25:28
news_8eab0a84604fabf8b8eec97cba3f1a76,美國總統大選辯論賀錦麗川普往中間靠 選民盼政策更具體,國際焦點,2024-09-11T10:50:16Z,（中央社記者石秀娟華盛頓11日專電）美國總統大選進入最後衝刺，民主黨候選人賀錦麗、共和黨候選人川普10日首度辯論，火花四起。兩人支持度旗鼓相當，辯論可見兩人都往中間靠，以吸引未決定的選民；有選民說，希望政策更具體。,https://www.cna.com.tw/news/aopl/202409110343.aspx,中央通訊社,https://www.cna.com.tw/list/aopl.aspx,09/18/2024 12:25:28
news_1fb8b071970e9d1b8d43bfbe41be7f4f,川普指稱移民吃寵物 海地政府譴責歧視性言論,國際焦點,2024-09-12T05:53:37Z,（中央社太子港\華盛頓11日綜合外電報導）海地政府今天譴責美國總統候選人川普與其他共和黨人的「歧視性言論」，即川普等人指稱海地移民在俄亥俄州吃掉貓狗寵物。,https://www.cna.com.tw/news/aopl/202409120154.aspx,中央通訊社,https://www.cna.com.tw/list/aopl.aspx,09/19/2024 12:20:41
news_dfe2c4c209bef26688ca6bee2c18a39a,紀念911恐攻23週年 拜登戴上川普紅帽展現團結,國際焦點,2024-09-12T01:54:32Z,（中央社美國姍克斯維爾11日綜合外電報導）美國總統拜登今天短暫戴上前總統川普的招牌紅帽，白宮表示，這是在2001年9月11日恐攻週年紀念活動上展現「團結」的做法。,https://www.cna.com.tw/news/aopl/202409120039.aspx,中央通訊社,https://www.cna.com.tw/list/aopl.aspx,09/19/2024 12:20:41
news_21c82c27a23e86c90eda78ad8e982f64,泰勒絲挺賀錦麗　川普嗆「將付出代價」：我才不是她粉絲,國際新聞,2024-09-11T21:35:00Z,在美國流行音樂天后泰勒絲（Taylor Swift）表態支持民主黨總統候選人賀錦麗後，前總統川普今天回應說，他不是泰勒絲的粉絲．她將在市場方面為此付出代價。,https://www.ettoday.net/news/20240912/2815406.htm,2011 ETtoday.net. All Rights Reserved.,https://www.ettoday.net,09/19/2024 12:20:41
news_a660da51b02d75b47f575a2b1e78a002,川普疑再遭暗殺未遂 賀錦麗選舉緊繃下致電慰問,國際焦點,2024-09-18T02:02:54Z,（中央社美國弗林特17日綜合外電報導）美國共和黨總統候選人川普遭遇另一次明顯的暗殺企圖後，副總統賀錦麗今天在選情緊繃之際致電慰問，但她在受訪時仍譴責川普「可惡地」散布海地移民吃寵物的不實言論。,https://www.cna.com.tw/news/aopl/202409180042.aspx,中央通訊社,https://www.cna.com.tw/list/aopl.aspx,09/25/2024 12:28:45
news_a70a5ab80e38199f11238a16327cdcad,美國暴力政治 恐成新常態,國際新聞,2024-09-16T21:30:00Z,〔編譯林家宇／綜合報導〕繼七月十三日賓州造勢場合遇襲後，美國前總統、共和黨總統候選人川普十五日再遭槍手刺殺未遂，引發各界對美國政治暴力愈加嚴重的擔憂。美國有線電視新聞網（CNN）、英國廣播公司（BBC）和衛報等美英媒體指出，由於華府近年政治分化嚴重，加上槍枝氾濫，暴力事件恐怕不再屬於特殊案例或缺失，…,https://news.ltn.com.tw/news/world/paper/1667469,自由時報,https://news.ltn.com.tw/list/breakingnews/world,09/24/2024 12:22:30
news_2dc385a973fdc171626efd872e266769,在川普辯論衰躺槍！德國回擊了 加碼反酸「我們也不吃貓狗」,國際新聞,2024-09-11T21:56:14Z,"首次上稿 9-11 22:49更新時間 9-12 05:56
吳裕堯／核稿編輯
美國前總統川普（Donald Trump）11日在總統大選辯論會上與民主黨總統候選人賀錦麗交鋒...…",https://news.ltn.com.tw/news/world/breakingnews/4797521,自由時報,https://news.ltn.com.tw/list/breakingnews/world,09/19/2024 12:20:41
news_f3b320903332d75d0f70139dfce63014,AIT前主席薄瑞光：川普較不熱衷結盟 不利美對台政策,國際焦點,2024-09-12T00:02:57Z,（中央社記者石秀娟華盛頓11日專電）前美國在台協會主席薄瑞光今天在一場線上論壇說，美國與亞洲盟友結盟是其處理台灣議題的關鍵要點之一，共和黨總統候選人川普對此較不熱衷，若這一政策重點弱化，對美國的台灣政策是不利的。,https://www.cna.com.tw/news/aipl/202409120023.aspx,中央通訊社,https://www.cna.com.tw/list/aopl.aspx,09/19/2024 12:20:41
news_f766db1127780f4979755b6787882727,民調：賀錦麗支持度領先擴大　關鍵搖擺州仍落後川普,國際新聞,2024-08-29T16:18:00Z,最新民調顯示，美國民主黨總統候選人賀錦麗以支持率45%，領先共和黨對手川普的41%，顯示她不僅激起選民熱情，也撼動11月5日總統大選選情，但她在關鍵數州的民調仍落後。,https://www.ettoday.net/news/20240830/2807201.htm,2011 ETtoday.net. All Rights Reserved.,https://www.ettoday.net,09/06/2024 12:19:40
news_66c7209abf27af67e26f0ea090d6b40c,簡訊曝光！川普「遇刺前90分鐘」警已鎖定嫌犯　1原因放過他,國際新聞,2024-07-30T02:35:00Z,美國前總統川普13日在賓州的造勢集會上遇刺。29日，愛荷華州共和黨聯邦參議員葛拉斯里向媒體曝光了執法人員的簡訊紀錄，顯示監控集會的警員早在槍擊發生前90分鐘就已發現刺客的存在，卻因通訊混亂未能及時應對，引發外界對警方安全措施有效性的質疑。,https://www.ettoday.net/news/20240730/2787131.htm,2011 ETtoday.net. All Rights Reserved.,https://www.ettoday.net,08/06/2024 12:18:35
news_cc1abe80838c7aef1beed75cb0709694,拜登剩餘任期重點！提最高法院3大改革　將修憲明定無人有豁免權,國際新聞,2024-07-30T04:47:00Z,美國總統拜登今天提3大改革最高法院的方向，將修憲納入「任何人不得凌駕法律」條文、立法限制大法官任期、制定大法官操守規範。美國最高法院近年爭議不斷，民調顯示，民眾不滿意度高達6成。,https://www.ettoday.net/news/20240730/2787358.htm,2011 ETtoday.net. All Rights Reserved.,https://www.ettoday.net,08/06/2024 12:18:35
news_e8de12e275b882999e5cb0006a689e33,美總統大選辯論後 川普旗下媒體股價與加密貨幣齊挫,國際焦點,2024-09-11T17:21:07Z,（中央社紐約11日綜合外電報導）美國總統大選辯論後，流行音樂天后泰勒絲表態支持民主黨總統候選人賀錦麗，前總統川普旗下社群媒體公司今天盤中股價大跌，加密貨幣價格也下挫，賀錦麗的賭盤勝率上升。,https://www.cna.com.tw/news/aopl/202409120003.aspx,中央通訊社,https://www.cna.com.tw/list/aopl.aspx,09/19/2024 12:20:41
news_cf630dcc3062f174f26596dc79a1e7b4,泰勒絲表態挺賀錦麗 川普酸：我才不是她粉絲,國際焦點,2024-09-11T18:18:12Z,（中央社華盛頓11日綜合外電報導）在美國流行音樂天后泰勒絲（Taylor Swift）表態支持民主黨總統候選人賀錦麗後，前總統川普今天回應說，他不是泰勒絲的粉絲．她將在市場方面為此付出代價。,https://www.cna.com.tw/news/aopl/202409120005.aspx,中央通訊社,https://www.cna.com.tw/list/aopl.aspx,09/19/2024 12:20:41
