識別碼,新聞標題,新聞分類,發布日期,新聞前言,新聞連結,來源媒體,來源媒體連結,資料更新時間
news_da5137ec88bf2e328c58c44ec47fc0f4,川普若重返白宮 星學者：美與東南亞關係可能趨冷淡,國際焦點,2024-11-05T12:07:12Z,（中央社記者李宗憲雅加達5日專電）美國總統大選登場，新加坡學者張嘉松今天說，共和黨總統候選人川普從未試圖了解東南亞國家的想法，他認為，若川普當選總統，美國與東南亞原本建立的關係可能會趨向冷淡。,https://www.cna.com.tw/news/aopl/202411050397.aspx,中央通訊社,https://www.cna.com.tw/list/aopl.aspx,11/12/2024 12:20:21
news_b2d16f2c3296a61aed05ce6abf767408,誰入主白宮較有利美中關係？ 中國學者很頭大,國際新聞,2024-10-16T16:41:49Z,"西方的中國觀察家對於設法破解精英政治中的隱密計謀，再熟悉不過；但現在卻是中國的分析家苦於解讀，美國總統大選兩黨候選人對最大地緣政治對手中國所持立場，究竟有何差異。

英國「衛報」（The...…",https://news.ltn.com.tw/news/world/breakingnews/4833057,自由時報,https://news.ltn.com.tw/list/breakingnews/world,10/24/2024 12:20:11
news_551834f6b592afb0c8e74e03a280ae3e,台灣若失去主權「歐洲將受中俄影響」 德學者籲政府正視威脅,國際新聞,2024-10-16T16:18:10Z,以色列裔德國作家塞利格曼（Rafael Seligmann）13日表示，如果台灣失去主權，歐洲在經濟上將受中國與俄羅斯影響，「這是歐洲現在仍無法想像的規模」。即便1945年以來發生近250場...…,https://news.ltn.com.tw/news/world/breakingnews/4833075,自由時報,https://news.ltn.com.tw/list/breakingnews/world,10/24/2024 12:20:11
news_e0413ec71da7dc78aa297ab0db616416,軍費分攤暴增9倍？川普稱南韓「提款機」 揚言每年收3200億,國際新聞,2024-10-16T22:55:51Z,"首次上稿 10-16 23:02更新時間 10-17 06:55

彭博報導，美國共和黨總統候選人川普15日受訪稱，長期盟友南韓是「提款機」（money machine），...…",https://news.ltn.com.tw/news/world/breakingnews/4833080,自由時報,https://news.ltn.com.tw/list/breakingnews/world,10/24/2024 12:20:11
news_911a1f558f55a906bc37b794b322fd75,"川普自稱「體外人工受精之父」 與賀錦麗爭女性選票
",國際新聞,2024-10-16T18:00:03Z,"美國共和黨總統候選人川普今天在全場觀眾都是女性的福斯新聞頻道（Fox News）節目上，自稱為「體外人工受精之父」，試圖爭取女性選票。

      法新社及美國有線電視新聞網（CNN）...…",https://news.ltn.com.tw/news/world/breakingnews/4833113,自由時報,https://news.ltn.com.tw/list/breakingnews/world,10/24/2024 12:20:11
news_9adfa51cb268369e32dc1debe26f77d6,"美百歲前總統卡特郵寄提前投票 實現心願投給賀錦麗
",國際新聞,2024-10-16T19:00:03Z,"美國前總統卡特（Jimmy Carter）今天透過郵寄方式提前選票，他曾在滿百歲前許下心願，希望自己活得夠久，將票投給民主黨總統候選人賀錦麗。

      法新社報導，根據「亞特蘭大新...…",https://news.ltn.com.tw/news/world/breakingnews/4833118,自由時報,https://news.ltn.com.tw/list/breakingnews/world,10/24/2024 12:20:11
news_1fcfbeaf2a92de01d497a7ada375e80a,賀錦麗造勢100多名共和黨人站台 尋求反川力量支持,國際新聞,2024-10-16T21:36:04Z,"美國民主黨總統候選人賀錦麗今天在搖擺州賓州造勢，尋求共和黨人的支持，現場有100多名共和黨人站台，緊接著她將接受保守派媒體福斯新聞頻道（Fox News）專訪。

      路透社報導...…",https://news.ltn.com.tw/news/world/breakingnews/4833129,自由時報,https://news.ltn.com.tw/list/breakingnews/world,10/24/2024 12:20:11
news_746fc74a4662c9fe81e7d08b859dfb86,爭取女性選票 川普自稱「體外人工受精之父」,國際新聞,2024-10-17T03:20:06Z,"莊文仁／核稿編輯
美國總統大選將於11月5日登場，共和黨籍前總統川普（Donald Trump）與民主黨籍現任副總統賀錦麗（Kamala Harris）持續爭取選民支持，川普在電...…",https://news.ltn.com.tw/news/world/breakingnews/4833196,自由時報,https://news.ltn.com.tw/list/breakingnews/world,10/24/2024 12:20:11
news_71bc3c8e3d52926fa5a968493c15446a,墮胎、經濟、犯罪…川普直球對決女性選民 搶攻婦女票,國際新聞,2024-10-17T02:41:30Z,美國前總統川普（Donald Trump）10月16日參與福斯新聞網（Fox News）「福克納焦點」（Faulkner Focus）節目中，舉辦一場專為女性選民設計的市民大會...…,https://news.ltn.com.tw/news/world/breakingnews/4833278,自由時報,https://news.ltn.com.tw/list/breakingnews/world,10/24/2024 12:20:11
news_48a9e24190d4e3711effa7f066553a3e,賀錦麗首登福斯新聞 迴避拜登認知問題聚焦批評川普,國際新聞,2024-10-17T04:08:41Z,美國副總統賀錦麗（Kamala Harris）16日首次正式接受福斯新聞網（Fox News）專訪，在距離美國總統大選僅剩三週之際，此舉格外引人注目。在專訪中，賀錦麗巧妙迴避了...…,https://news.ltn.com.tw/news/world/breakingnews/4833342,自由時報,https://news.ltn.com.tw/list/breakingnews/world,10/24/2024 12:20:11
news_d3b8637b01f93bf262c530d631c60d7d,終於對2020年大選結果表態 范斯：川普沒有輸！,國際新聞,2024-10-17T07:01:15Z,"郭顏慧／核稿編輯
美國前總統、共和黨總統候選人川普在2020年拒絕承認敗選，支持者還衝入國會大廈，引發社會動盪，共和黨副總統候選人范斯（JD Vance）也被多次詢問關於這件事看...…",https://news.ltn.com.tw/news/world/breakingnews/4833621,自由時報,https://news.ltn.com.tw/list/breakingnews/world,10/24/2024 12:20:11
news_e9b3b1c5e0089010dcb96077162ed91d,胡蘿蔔加棒子！拜登對以色列祭軍援利誘 人道施壓雙管齊下,國際新聞,2024-10-17T08:26:09Z,美國總統拜登在任期最後幾個月採取高風險策略，透過軍事援助及施壓以色列，試圖影響其與伊朗及伊朗支持的武裝組織間的緊張關係。然而，距離美國總統大選僅剩數週，此策略的成效仍充滿不確定...…,https://news.ltn.com.tw/news/world/breakingnews/4833744,自由時報,https://news.ltn.com.tw/list/breakingnews/world,10/24/2024 12:20:11
news_becc84c1ccecfb80e8ff663fcb20a24e,前司法部長甘迺迪遺孀喪禮「冷淡互動」 拜登、裴洛西恩怨再引關注,國際新聞,2024-10-17T09:15:34Z,美國總統拜登與前聯邦眾議院議長裴洛西15日在甘迺迪家族大家長、前美國司法部長羅伯特·甘迺迪（Robert F. Kennedy）遺孀艾賽爾（Ethel Kennedy）的喪禮上...…,https://news.ltn.com.tw/news/world/breakingnews/4833828,自由時報,https://news.ltn.com.tw/list/breakingnews/world,10/24/2024 12:20:11
news_9ef8e02cb5991796f3557e6711183416,澤倫斯基「勝利方案」細節曝光！盼加入北約 歐美態度審慎,國際新聞,2024-10-17T12:44:20Z,烏克蘭總統澤倫斯基17日抵達布魯塞爾，向歐盟（EU）與北大西洋公約組織（NATO）領袖提出其「勝利計畫」。澤倫斯基強調，烏克蘭必須在與俄羅斯和談之前，首先建立強勢地位。該計畫的...…,https://news.ltn.com.tw/news/world/breakingnews/4834150,自由時報,https://news.ltn.com.tw/list/breakingnews/world,10/24/2024 12:20:11
news_c774989e968463b93cd9c2b0539ae282,喬治亞州選務主管遭炸彈威脅 內部員工自導自演被捕,國際焦點,2024-11-05T13:30:57Z,（中央社喬治亞州瓊斯郡4日綜合外電報導）美國大選搖擺州喬治亞州的1名選務人員今天遭到逮捕，罪名是假借選民名義，向選務機關主管寄出1封信，威脅要用炸彈攻擊其他選務人員。,https://www.cna.com.tw/news/aopl/202411050418.aspx,中央通訊社,https://www.cna.com.tw/list/aopl.aspx,11/12/2024 12:20:21
news_57872516a257a54f31e39ced27d3cbca,美國總統大選牽動國會 參眾兩院勢力版圖可能反轉,國際焦點,2024-11-05T14:14:39Z,（中央社華盛頓5日綜合外電報導）今天登場的美國大選可能會讓參眾兩院勢力版圖反轉，但無論是共和黨籍前總統川普或民主黨候選人賀錦麗勝選，可能仍將出現參眾兩院由不同政黨控制的國會分裂格局。,https://www.cna.com.tw/news/aopl/202411050436.aspx,中央通訊社,https://www.cna.com.tw/list/aopl.aspx,11/12/2024 12:20:21
news_25b9005566e91f2f640d925e65d4a438,任期將屆盼留政治遺產 拜登在白宮官邸觀看開票結果,國際焦點,2024-11-05T14:54:48Z,（中央社華盛頓5日綜合外電報導）儘管美國現任總統拜登任期將屆，他的名字也未出現在總統選票上，大選結果仍攸關他的政治遺產能否延續。美媒報導，拜登將偕同夫人與親信，在白宮官邸觀看開票結果。,https://www.cna.com.tw/news/aopl/202411050440.aspx,中央通訊社,https://www.cna.com.tw/list/aopl.aspx,11/12/2024 12:20:21
news_f6f6974c31ac13dd7a87d86f9b17dbba,辯論進入倒計時！賀錦麗重拳出擊 挑戰川普執政黑歷史,國際新聞,2024-09-03T01:35:29Z,美國副總統賀錦麗（Kamala Harris）正積極為即將到來的總統辯論做準備，這場辯論將於9月10日在費城的國家憲法中心（National Constitution Cent...…,https://news.ltn.com.tw/news/world/breakingnews/4788191,自由時報,https://news.ltn.com.tw/list/breakingnews/world,09/10/2024 12:17:57
news_3576add474227f67e3095f3dedea3856,川普「音樂侵權」受害者再+1  ABBA要求川普團隊別再播,國際新聞,2024-09-03T04:16:30Z,"黃其豪／核稿編輯
美國共和黨總統候選人、前總統川普競選團隊過去曾多次發生在未經歌手授權的情況下擅自播放歌曲，如今又出現最新「受害者」，瑞典傳奇天團「阿巴合唱團」（ABBA）透過《...…",https://news.ltn.com.tw/news/world/breakingnews/4788326,自由時報,https://news.ltn.com.tw/list/breakingnews/world,09/10/2024 12:17:57
news_1e0ed9214a16ea1b00af3e23cc238cf0,川普承諾澤倫斯基 勝選續挺烏抗俄,國際新聞,2024-09-29T21:30:00Z,"〔編譯陳成良／綜合報導〕烏克蘭總統澤倫斯基訪問美國期間，廿七日與美國共和黨總統候選人、前總統川普會面，闡述他的「勝利計畫」。川普則承諾，若他在十一月的大選中獲勝，將會繼續支持烏克蘭對抗俄羅斯。這場會晤彰顯美國民主、共和兩黨在烏克蘭政策上的分歧，並反映出美國大選結果可能對烏克蘭戰局產生深遠影響。
澤…",https://news.ltn.com.tw/news/world/paper/1669616,自由時報,https://news.ltn.com.tw/list/breakingnews/world,10/07/2024 12:19:59
news_6e44742e9cdd0d3f23a0c0d822120ccd,音樂就是Peace 郭虔哲率三重奏來台玩古典,國際焦點,2024-10-01T08:54:41Z,（中央社記者廖漢原紐約1日專電）古典樂界年度重頭戲，大提琴家郭虔哲與美國及法國的小提琴家和鋼琴家，以CDK三重奏組合，月底在高雄與台北演出。郭虔哲把演出當作給自己的生日禮物，團聚家族與好友，在紊亂世局中盡音樂家的責任，分享和平。,https://www.cna.com.tw/news/acul/202410010302.aspx,中央通訊社,https://www.cna.com.tw/list/aopl.aspx,10/08/2024 12:23:46
news_27af639e9177e66ed2d1f072748eba10,喬州提前投票 首日人數破紀錄,國際新聞,2024-10-16T21:30:00Z,"加上不在籍 首日32.8萬人投票

〔編譯管淑平／綜合報導〕美國民主、共和兩黨候選人賀錦麗和川普在搖擺州競爭激烈，可能左右選舉結果的搖擺州之一喬治亞州，十五日起展開提前投票，首日開放投票六小時，投票人數就打破先前紀錄，到當天深夜已有卅二萬八千人投票。

首日投票人數 是上屆兩倍多

喬治…",https://news.ltn.com.tw/news/world/paper/1672327,自由時報,https://news.ltn.com.tw/list/breakingnews/world,10/24/2024 12:20:11
news_291ebcc60a62987e5631eacdfbd703a3,不認造謠移民吃寵物！　 川普：只是講述報導內容,國際新聞,2024-10-17T06:33:00Z,美國共和黨總統候選人川普今天在邁阿密參加市民大會時，堅持他遭控不實的「移民在俄亥俄州吃寵物」說法，並向拉美裔選民表示，他「只是講述報導的內容」。,https://www.ettoday.net/news/20241017/2836916.htm,2011 ETtoday.net. All Rights Reserved.,https://www.ettoday.net,10/24/2024 12:20:11
news_6318ab5dbd5b41f359cd1b0dabbfe999,川、賀激戰搖擺州喬治亞 提前投票首日催出32.8萬人創新高,國際新聞,2024-10-16T22:37:43Z,"首次上稿 10-16 22:51更新時間 10-17 06:37

美國總統選戰民主黨候選人賀錦麗與共和黨候選人川普在搖擺州競爭激烈，可能左右選舉結果的搖擺州之一喬治亞，1...…",https://news.ltn.com.tw/news/world/breakingnews/4833055,自由時報,https://news.ltn.com.tw/list/breakingnews/world,10/24/2024 12:20:11
news_7bcdda7cfe3b061d711c7e25fde14e7c,紐時公開挺賀錦麗 指川普若當選恐深深傷害民主,國際焦點,2024-10-01T02:01:34Z,（中央社紐約30日綜合外電報導）「紐約時報」編輯委員會今天刊登文章，表態支持美國民主黨總統候選人賀錦麗（Kamala Harris），稱她在這場與共和黨籍對手川普競爭的選舉中是「唯一愛國的總統選擇」。,https://www.cna.com.tw/news/aopl/202410010054.aspx,中央通訊社,https://www.cna.com.tw/list/aopl.aspx,10/08/2024 12:23:46
news_e0360674428d38f49c0304bf1f397635,阻俄干預大選 美提供3.2億賞金,國際新聞,2024-10-20T12:50:36Z,美國總統大選將至，國務院19日公布設立高達1000萬美元（約3.2億台幣）的「正義賞金」（Rewards for Justice），獎勵提供外國個人或實體干預選舉的資訊，更點名...…,https://news.ltn.com.tw/news/world/breakingnews/4836812,自由時報,https://news.ltn.com.tw/list/breakingnews/world,10/27/2024 12:22:58
news_f046821add37d86c6ebd42034f43223e,賀錦麗搖擺州與民有約表現得負評 自家人也挺不下去,國際焦點,2024-10-24T14:58:11Z,（中央社華盛頓24日綜合外電報導）美國總統大選進入決戰階段，民主黨候選人賀錦麗聲勢走下坡。她昨天參加接受選民現場提問的電視節目，表現又被評為「語多累贅而且閃爍其詞」，就連黨內策士都對她不假辭色。,https://www.cna.com.tw/news/aopl/202410240418.aspx,中央通訊社,https://www.cna.com.tw/list/aopl.aspx,10/31/2024 12:21:47
news_3003e1521efb420e4918b4484eaed30f,川普：中國若「進入」台灣　將徵收額外關稅,國際新聞,2024-10-19T01:14:00Z,「華爾街日報」報導，美國共和黨總統候選人川普表示，如果中國「進入」台灣，他將對中國徵收額外關稅。,https://www.ettoday.net/news/20241019/2838070.htm,2011 ETtoday.net. All Rights Reserved.,https://www.ettoday.net,10/26/2024 12:24:34
news_a759e6dee401f4fee63141ee456981fb,卡特成美國首位百歲卸任總統 喬治亞州鄉親歡慶,國際焦點,2024-10-01T04:25:59Z,（中央社喬治亞州平原鎮1日綜合外電報導）美國喬治亞州平原鎮今天慶祝前總統卡特100歲生日，被鄉親視為英雄的卡特將成為美國歷來唯一活到百歲高齡的卸任總統，軍機空中分列式已備妥，曲目也完成排練。,https://www.cna.com.tw/news/aopl/202410010148.aspx,中央通訊社,https://www.cna.com.tw/list/aopl.aspx,10/08/2024 12:23:46
news_f89bfdeca1ab32b8ca81781a7cdee14e,CNN：從卡特百歲生日 看美國社會安全網亟需改革,國際焦點,2024-10-01T05:50:23Z,（中央社華盛頓30日綜合外電報導）美國前總統卡特明天將慶祝100歲生日，成為美國第一位年滿百歲的卸任總統。美國有線電視新聞網（CNN）指出，未來會有愈來愈多美國人如此長壽，而社會安全網尚未做好準備。,https://www.cna.com.tw/news/aopl/202410010185.aspx,中央通訊社,https://www.cna.com.tw/list/aopl.aspx,10/08/2024 12:23:46
news_09d231c0e2f75f33543ed60f4f47ae5c,颶風海倫肆虐逾130死 救災應變捲入美國大選角力,國際焦點,2024-10-01T06:41:42Z,（中央社喬治亞州瓦多斯塔30日綜合外電報導）颶風海倫襲捲美國東南部，救災應變成總統大選焦點。川普今天趕赴災區勘災，誣指當局拒絕援助共和黨支持者，遭拜登駁斥「撒謊」，拜登也宣布2日將挺進前線指揮。,https://www.cna.com.tw/news/aopl/202410010221.aspx,中央通訊社,https://www.cna.com.tw/list/aopl.aspx,10/08/2024 12:23:46
news_c9fdc8899f9e530408ba5c4470753245,美副總統辯論5大看點 華茲范斯砲火瞄準對方爭議言行,國際焦點,2024-10-01T12:11:30Z,（中央社華盛頓1日綜合外電報導）美國民主黨副總統候選人華茲與共和黨對手范斯，將於美東時間今晚9時（台灣時間2日上午9時）進行2024年大選唯一一場副總統辯論，CNN列出這場辯論有5大看點。,https://www.cna.com.tw/news/aopl/202410010432.aspx,中央通訊社,https://www.cna.com.tw/list/aopl.aspx,10/08/2024 12:23:46
news_b4f71ca418f107c5f2c5349768a68678,川普再遭暗殺未遂　怪拜登賀錦麗：他們的煽動性語言害我被開槍,國際新聞,2024-09-16T17:33:00Z,美國共和黨總統候選人川普16日將自己看似遭遇第2起未遂暗殺，怪罪於民主黨總統候選人賀錦麗與現任總統拜登的「煽動性語言」。,https://www.ettoday.net/news/20240917/2818275.htm,2011 ETtoday.net. All Rights Reserved.,https://www.ettoday.net,09/24/2024 12:22:30
news_811aa3988c15a492840686e7bb83ca2a,滲透華裔人士干政　紐時：北京企圖影響西方民主政治,國際新聞,2024-09-16T22:48:00Z,美國「紐約時報」今天報導，紐約州前副幕僚長孫雯涉嫌收受利益影響州政府案，是中國企圖影響西方民主國家政治的手段。但各國因應方式也引起針對華裔社群的疑慮。,https://www.ettoday.net/news/20240917/2818290.htm,2011 ETtoday.net. All Rights Reserved.,https://www.ettoday.net,09/24/2024 12:22:30
news_35d720edd6591ee21a5b338a3bb30257,川普再遇暗殺未遂　58歲嫌犯被控違反聯邦槍枝法,國際新聞,2024-09-16T21:33:00Z,美國共和黨總統候選人、前總統川普（Donald Trump）昨天遭遇未遂暗殺，意圖暗殺川普的男性嫌犯勞斯（Ryan Wesley Routh）今天被檢方控訴違反聯邦槍枝法。,https://www.ettoday.net/news/20240917/2818293.htm,2011 ETtoday.net. All Rights Reserved.,https://www.ettoday.net,09/24/2024 12:22:30
news_57b39eb061a025339cf83ea970aa942b,川普盛讚特勤局！　批政治風向「太骯髒」：我不當選會更糟,國際新聞,2024-09-17T01:13:00Z,美國共和黨總統候選人川普16日險些再度遇襲，所幸特勤局隊員及時發現異狀，並最終將58歲的極左派份子魯斯（Ryan Wesley Routh）逮補。川普盛讚特勤局「無庸置疑幹得好」；他還說當前美國政治氣候實在「太骯髒」，若他不當選會更嚴重。,https://www.ettoday.net/news/20240917/2818334.htm,2011 ETtoday.net. All Rights Reserved.,https://www.ettoday.net,09/24/2024 12:22:30
news_09d0fd9d565d854974e1f6018e127efa,川普再遇暗殺　俄官員暗指烏克蘭「買兇殺人」！烏國際軍團急撇清,國際新聞,2024-09-17T03:04:00Z,美國前總統川普15日在佛州打高爾夫球，險遭埋伏在灌木叢的58歲槍手魯斯（Ryan Wesley Routh）襲擊，動機目前不明，但他過去的發文顯示他力挺烏克蘭，更曾親自赴烏想參戰抗俄。俄羅斯前總統暗指烏克蘭雇用魯斯暗殺川普，但國際傭兵團已經澄清，他們和魯斯毫無關聯。,https://www.ettoday.net/news/20240917/2818386.htm,2011 ETtoday.net. All Rights Reserved.,https://www.ettoday.net,09/24/2024 12:22:30
news_3b4906aef34c6787d12b03586db5b9a3,賀錦麗支持者憂心 川普若落選是否阻和平移轉政權,國際焦點,2024-10-17T23:22:47Z,（中央社記者石秀娟華盛頓17日專電）美國總統大選勝負難料，共和黨總統候選人川普至今仍未承諾，如果輸掉選舉，他願意認輸；甚至曾說，他落選可能發生「血洗」。民主黨賀錦麗的支持者憂心對手選後是否會阻擾和平移轉政權。,https://www.cna.com.tw/news/aopl/202410180014.aspx,中央通訊社,https://www.cna.com.tw/list/aopl.aspx,10/25/2024 12:21:25
news_050c7a0b6ca0b0f487f4213b04b3bfce,馬斯克賓州催票 警告川普勝敗決定西方文明命運,國際焦點,2024-10-18T02:40:54Z,（中央社華盛頓17日綜合外電報導）美國億萬富豪馬斯克今天現身總統大選關鍵搖擺州賓夕法尼亞州，為共和黨總統候選人川普展開連續5晚的造勢活動，並警告川普能否重返白宮將決定「西方文明的命運」。,https://www.cna.com.tw/news/aopl/202410180045.aspx,中央通訊社,https://www.cna.com.tw/list/aopl.aspx,10/25/2024 12:21:25
news_4f793fc4724fdc47cbc08227c9d17d08,川普：澤倫斯基根本不該讓俄烏戰爭發生,國際焦點,2024-10-18T02:49:03Z,（中央社華盛頓17日綜合外電報導）美國共和黨總統候選人川普今天將俄烏戰爭歸咎於烏克蘭總統澤倫斯基，稱他未能善盡職責阻止這場戰爭發生。,https://www.cna.com.tw/news/aopl/202410180049.aspx,中央通訊社,https://www.cna.com.tw/list/aopl.aspx,10/25/2024 12:21:25
news_bef5316811be523c50d381c04bf14b2c,IMF：中國無法再仰賴出口推動成長 應轉向消費驅動,國際焦點,2024-10-18T05:24:26Z,（中央社華盛頓17日綜合外電報導）國際貨幣基金總裁喬治艾娃（Kristalina Georgieva）今天告訴路透社，中國大到無法持續仰賴出口來推動經濟成長，除非轉向消費驅動的經濟模式，否則恐面臨危險的成長放緩。,https://www.cna.com.tw/news/aopl/202410180117.aspx,中央通訊社,https://www.cna.com.tw/list/aopl.aspx,10/25/2024 12:21:25
news_8a8d00816b52a9a7fd8c4b366ffa2c37,美國大選搖擺州民調膠著 賀錦麗轉變策略強攻川普,國際焦點,2024-10-18T09:10:35Z,（中央社華盛頓17日綜合外電報導）美國大選逼近，共和黨總統候選人川普民調支持率攀升，令民主黨焦慮不已，黨內候選人賀錦麗正加緊調整競選策略，以吸引更多男性與共和黨選民支持，並加強對川普的攻勢。,https://www.cna.com.tw/news/aopl/202410180234.aspx,中央通訊社,https://www.cna.com.tw/list/aopl.aspx,10/25/2024 12:21:25
news_923eb0dae10a67d1085b071995e1191b,美國大選倒數 賀錦麗爭取搖擺州、川普批澤倫斯基陷爭議,國際焦點,2024-10-18T09:54:57Z,（中央社美國綠灣17日綜合外電報導）美國總統大選選情膠著，兩位候選人爭取猶豫不決的選民支持，民主黨的賀錦麗今天在搖擺州威斯康辛州造勢，共和黨的川普則因抨擊處境艱難的美國盟友烏克蘭而陷入爭議。,https://www.cna.com.tw/news/aopl/202410180272.aspx,中央通訊社,https://www.cna.com.tw/list/aopl.aspx,10/25/2024 12:21:25
news_f2a8c6a439c9c646cf0f3000488b83fd,川普稱關稅高牆保護經濟 美財長打臉批嚴重誤導,國際焦點,2024-10-18T11:24:40Z,（中央社華盛頓17日綜合外電報導）美國前總統、共和黨總統候選人川普提出對盟友和競爭對手課徵高關稅以保護美國經濟。財政部長葉倫今天予以打臉，稱這類行動「嚴重誤導」。,https://www.cna.com.tw/news/aopl/202410180320.aspx,中央通訊社,https://www.cna.com.tw/list/aopl.aspx,10/25/2024 12:21:25
news_8322a4ae436befe7825590c3c3b9f4bf,賀錦麗拚打破民調僵局 60歲生日前夕大打年齡牌,國際焦點,2024-10-18T12:20:35Z,（中央社華盛頓18日綜合外電報導）美國民主黨總統候選人賀錦麗將於本月20日慶祝60歲生日，為在激烈選戰中拉抬民調，她打出年齡牌，加強攻擊78歲共和黨對手川普，質疑他的心智狀態不適合出任總統。,https://www.cna.com.tw/news/aopl/202410180346.aspx,中央通訊社,https://www.cna.com.tw/list/aopl.aspx,10/25/2024 12:21:25
news_3a65623735c0f98e9239eb29f5c56ea4,從比特幣到墨西哥披索 金融市場「川普交易」再現,國際焦點,2024-10-18T14:06:58Z,（中央社紐約18日綜合外電報導）目前距離11月5日美國總統大選登場不到3週，在選情日益緊繃之際，可能受共和黨籍總統候選人川普（Donald Trump）重返白宮影響的部分金融市場領域，再度出現「川普交易」。,https://www.cna.com.tw/news/aopl/202410180383.aspx,中央通訊社,https://www.cna.com.tw/list/aopl.aspx,10/25/2024 12:21:25
news_1cc694758e1e6880a6bcfd7080589893,億萬富豪庫班挺賀錦麗 批川普主張對中國加關稅,國際焦點,2024-10-18T14:22:15Z,（中央社威斯康辛州拉克羅斯17日綜合外電報導）美國億萬富豪庫班支持民主黨總統候選人賀錦麗，他今天抨擊共和黨總統候選人川普擬向大多數中國商品加徵關稅的主張，還稱此舉會使美國人受害而非中國人。,https://www.cna.com.tw/news/aopl/202410180391.aspx,中央通訊社,https://www.cna.com.tw/list/aopl.aspx,10/25/2024 12:21:25
news_2ef4fc0ff1dedbe90ca5e86518477b99,賀錦麗與川普鎖定藍牆州  同日赴密西根造勢拉票,國際焦點,2024-10-18T15:12:37Z,（中央社密西根州大急流城18日綜合外電報導）美國副總統、民主黨總統候選人賀錦麗與前總統、共和黨總統候選人川普今天都前往密西根州進行競選造勢，兩人試圖在這個關鍵搖擺州拉票和固票。,https://www.cna.com.tw/news/aopl/202410180400.aspx,中央通訊社,https://www.cna.com.tw/list/aopl.aspx,10/25/2024 12:21:25
